userID,full_name,time,role,message,date,year,month,day,NewLoanFlow,NewLoanFlowStatus
1.01929E+15,??????? ??????,9/4/2020 15:50,User,????????????,9/4/2020,2020,9,4,3.5,
1.01929E+15,??????? ??????,9/4/2020 15:50,Admin,"??????????????????????????????????????????
??????????????????? 10 ?????????? ???? ""0880880880""",9/4/2020,2020,9,4,3.5,Outside
1.01929E+15,??????? ??????,9/4/2020 15:50,User,????????????????????????????,9/4/2020,2020,9,4,3.5,
1.01929E+15,??????? ??????,9/4/2020 15:50,Admin,"?????????????? ?????????????????????????????????????????? ??
?????????????????????????",9/4/2020,2020,9,4,3.5,Outside
1.22241E+15,???????? ????????????,8/31/2020 19:58,Admin,?? ??,8/31/2020,2020,8,31,1.5,
1.22241E+15,???????? ????????????,8/31/2020 19:58,Admin,??????????????????? ?????????????????????????????,8/31/2020,2020,8,31,1.5,Outside
1.22241E+15,???????? ????????????,8/31/2020 19:58,Admin,??????????????????? ?????????????????????????????,8/31/2020,2020,8,31,1.5,Outside
1.22241E+15,???????? ????????????,8/31/2020 19:58,Admin,??????????????????? ?????????????????????????????,8/31/2020,2020,8,31,1.5,Outside
1.22241E+15,???????? ????????????,8/31/2020 19:58,Admin,?? ??,8/31/2020,2020,8,31,1.5,
1.22241E+15,???????? ????????????,8/31/2020 19:58,Admin,??????????????????? ?????????????????????????????,8/31/2020,2020,8,31,1.5,Outside
1.22241E+15,???????? ????????????,8/31/2020 19:58,Admin,??????????????????? ?????????????????????????????,8/31/2020,2020,8,31,1.5,Outside
1.22241E+15,???????? ????????????,8/31/2020 19:58,Admin,??????????????????? ?????????????????????????????,8/31/2020,2020,8,31,1.5,Outside
1.22241E+15,???????? ????????????,8/31/2020 19:59,Admin,CRS_Carinsurance2,8/31/2020,2020,8,31,1.5,
1.22241E+15,???????? ????????????,8/31/2020 19:59,Admin,??????????????????? ?????????????????????????????,8/31/2020,2020,8,31,1.5,Outside
1.25615E+15,?. ??????????,8/31/2020 6:46,User,??????,8/31/2020,2020,8,31,11.5,
1.25615E+15,?. ??????????,8/31/2020 6:46,Admin,"???????????????? ???????????????????? ???????????????????????? ??
(???????????? ?????)",8/31/2020,2020,8,31,11.5,Outside
1.28891E+15,Nampueng Suktun,8/31/2020 11:55,User,????????????????????????????????,8/31/2020,2020,8,31,1.5,
1.28891E+15,Nampueng Suktun,8/31/2020 11:55,Admin,??????????????????? ?????????????????????????????,8/31/2020,2020,8,31,1.5,Outside
1.28891E+15,Nampueng Suktun,8/31/2020 11:55,User,???????? ??????,8/31/2020,2020,8,31,2.5,
1.28891E+15,Nampueng Suktun,8/31/2020 11:55,Admin,??????? - ??????? ????????,8/31/2020,2020,8,31,2.5,Outside
1.3318E+15,Kanna Kanna,9/7/2020 7:07,Admin,CRS_Carinsurance2,9/7/2020,2020,9,7,1.5,
1.3318E+15,Kanna Kanna,9/7/2020 7:07,Admin,??????????????????? ?????????????????????????????,9/7/2020,2020,9,7,1.5,Outside
1.36774E+15,???? ???,8/8/2020 9:14,User,0623421774?,8/8/2020,2020,8,8,3.5,
1.36774E+15,???? ???,8/8/2020 9:14,Admin,"??????????????????????????????????????????
??????????????????? 10 ????????? ???? ""0880880880""",8/8/2020,2020,8,8,3.5,Outside
1.45662E+15,???????? ??????,8/29/2020 11:55,Admin,CRS_Carinsurance2,8/29/2020,2020,8,29,1.5,
1.45662E+15,???????? ??????,8/29/2020 11:55,Admin,??????????????????? ?????????????????????????????,8/29/2020,2020,8,29,1.5,Outside
1.48086E+15,?????? ????????,9/3/2020 16:58,Admin,???????????????????? ??????????????????????????????,9/3/2020,2020,9,3,1.5,
1.48086E+15,?????? ????????,9/3/2020 16:58,Admin,??????????????????? ?????????????????????????????,9/3/2020,2020,9,3,1.5,Outside
1.48317E+15,Piyah Bee Bozo,8/5/2020 16:08,Admin,????????????????????????????????????,8/5/2020,2020,8,5,5.5,
1.48317E+15,Piyah Bee Bozo,8/5/2020 16:08,Admin,???????????????????????????????????????,8/5/2020,2020,8,5,5.5,Outside
1.48317E+15,Piyah Bee Bozo,8/5/2020 16:08,Admin,?????? ?????????????,8/5/2020,2020,8,5,6.5,
1.48317E+15,Piyah Bee Bozo,8/5/2020 16:08,Admin,?????????????????????????????????????,8/5/2020,2020,8,5,6.5,Outside
1.48317E+15,Piyah Bee Bozo,8/5/2020 16:08,Admin,?? ??,8/5/2020,2020,8,5,10.5,
1.48317E+15,Piyah Bee Bozo,8/5/2020 16:08,Admin,??????????? ????????????????????????????????,8/5/2020,2020,8,5,10.5,Outside
1.48317E+15,Piyah Bee Bozo,8/5/2020 21:37,Admin,????????????????????????????????????,8/5/2020,2020,8,5,5.5,
1.48317E+15,Piyah Bee Bozo,8/5/2020 21:37,Admin,???????????????????????????????????????,8/5/2020,2020,8,5,5.5,Outside
1.48317E+15,Piyah Bee Bozo,8/5/2020 21:38,Admin,?????? ?????????????,8/5/2020,2020,8,5,6.5,
1.48317E+15,Piyah Bee Bozo,8/5/2020 21:38,Admin,?????????????????????????????????????,8/5/2020,2020,8,5,6.5,Outside
1.48317E+15,Piyah Bee Bozo,8/5/2020 21:38,Admin,?? ??,8/5/2020,2020,8,5,10.5,
1.48317E+15,Piyah Bee Bozo,8/5/2020 21:38,Admin,??????????? ????????????????????????????????,8/5/2020,2020,8,5,10.5,Outside
1.48317E+15,Piyah Bee Bozo,8/5/2020 21:39,User,???????,8/5/2020,2020,8,5,12.5,
1.48317E+15,Piyah Bee Bozo,8/5/2020 21:39,Admin,"?????????????????? ???????????????????? ???????????????????????? ??
(???????????? ????????)",8/5/2020,2020,8,5,12.5,Outside
1.48317E+15,Piyah Bee Bozo,8/25/2020 16:22,User,????????,8/25/2020,2020,8,25,3.5,
1.48317E+15,Piyah Bee Bozo,8/25/2020 16:23,Admin,"??????????????????????????????????????????
??????????????????? 10 ????????? ???? ""0880880880""",8/25/2020,2020,8,25,3.5,Outside
1.48317E+15,Piyah Bee Bozo,8/25/2020 16:23,User,????????????????????????????,8/25/2020,2020,8,25,3.5,
1.48317E+15,Piyah Bee Bozo,8/25/2020 16:23,Admin,"?????????????? ?????????????????????????????????????????? ??
????????????????????????",8/25/2020,2020,8,25,3.5,Outside
1.55306E+15,Bam Kanokporn,8/25/2020 16:10,Admin,IMG_Answer,8/25/2020,2020,8,25,6.5,
1.55306E+15,Bam Kanokporn,8/25/2020 16:10,Admin,?????????????????????????????????????,8/25/2020,2020,8,25,6.5,Outside
1.59526E+15,Napat Inprasert,8/13/2020 23:10,Admin,?????? ?????????????,8/13/2020,2020,8,13,6.5,
1.59526E+15,Napat Inprasert,8/13/2020 23:10,Admin,?????????????????????????????????????,8/13/2020,2020,8,13,6.5,Outside
1.63505E+15,Aumaim Agas,8/28/2020 8:48,User,????????????????????????????????????,8/28/2020,2020,8,28,3.5,
1.63505E+15,Aumaim Agas,8/28/2020 8:48,Admin,"??????????????????????????????????????????
??????????????????? 10 ?????????? ???? ""0880880880""",8/28/2020,2020,8,28,3.5,Outside
1.63505E+15,Aumaim Agas,8/28/2020 8:48,User,????????????????????????????,8/28/2020,2020,8,28,3.5,
1.63505E+15,Aumaim Agas,8/28/2020 8:48,Admin,"?????????????? ?????????????????????????????????????????? ??
?????????????????????????",8/28/2020,2020,8,28,3.5,Outside
1.6354E+15,Supaporn Srithong,9/5/2020 22:33,User,???110i,9/5/2020,2020,9,5,8.5,
1.6354E+15,Supaporn Srithong,9/5/2020 22:33,Admin,"??????????????????????????
?????? ??????
?????? ??? 110
?? 2012",9/5/2020,2020,9,5,8.5,Outside
1.67733E+15,Champ Detasawanong,8/5/2020 21:05,User,097-0849394,8/5/2020,2020,8,5,3.5,
1.67733E+15,Champ Detasawanong,8/5/2020 21:05,Admin,"??????????????????????????????????????????
??????????????????? 10 ????????? ???? ""0880880880""",8/5/2020,2020,8,5,3.5,Outside
1.69178E+15,???? ???????,8/29/2020 8:10,Admin,CRS_Carinsurance2,8/29/2020,2020,8,29,1.5,
1.69178E+15,???? ???????,8/29/2020 8:10,Admin,??????????????????? ?????????????????????????????,8/29/2020,2020,8,29,1.5,Outside
1.69178E+15,???? ???????,8/29/2020 8:18,User,????????,8/29/2020,2020,8,29,12.5,
1.69178E+15,???? ???????,8/29/2020 8:18,Admin,"?????????????????? ???????????????????? ???????????????????????? ??
(???????????? ????????)",8/29/2020,2020,8,29,12.5,Outside
1.69292E+15,Kamolwan Udomjaithamakul,9/6/2020 21:18,User,?????????.?????????? ??????????????2??????????,9/6/2020,2020,9,6,2.5,
1.69292E+15,Kamolwan Udomjaithamakul,9/6/2020 21:18,Admin,??????? - ??????? ????????,9/6/2020,2020,9,6,2.5,Outside
1.70192E+15,Grape Grape,9/4/2020 12:46,Admin,?????? ????????????,9/4/2020,2020,9,4,6.5,
1.70192E+15,Grape Grape,9/4/2020 12:46,Admin,??????????????????????????????????,9/4/2020,2020,9,4,6.5,Outside
1.71155E+15,Thawikhun Kai Sokklang,9/4/2020 21:13,User,????????????1??,9/4/2020,2020,9,4,1.5,
1.71155E+15,Thawikhun Kai Sokklang,9/4/2020 21:13,Admin,??????????????????? ?????????????????????????????,9/4/2020,2020,9,4,1.5,Outside
1.71264E+15,Nam Suphapon,9/3/2020 12:52,Admin,?? ??,9/3/2020,2020,9,3,1.5,
1.71264E+15,Nam Suphapon,9/3/2020 12:52,Admin,??????????????????? ?????????????????????????????,9/3/2020,2020,9,3,1.5,Outside
1.71264E+15,Nam Suphapon,9/3/2020 12:52,Admin,??????????????????? ?????????????????????????????,9/3/2020,2020,9,3,1.5,Outside
1.71264E+15,Nam Suphapon,9/3/2020 12:52,Admin,??????????????????? ?????????????????????????????,9/3/2020,2020,9,3,1.5,Outside
1.71264E+15,Nam Suphapon,9/3/2020 12:54,User,???????????2019??,9/3/2020,2020,9,3,1.5,
1.71264E+15,Nam Suphapon,9/3/2020 12:54,Admin,??????????????????? ?????????????????????????????,9/3/2020,2020,9,3,1.5,Outside
1.72926E+15,Marisa Maliram,8/20/2020 22:15,User,???????????,8/20/2020,2020,8,20,3.5,
1.72926E+15,Marisa Maliram,8/20/2020 22:15,Admin,"??????????????????????????????????????????
??????????????????? 10 ????????? ???? ""0880880880""",8/20/2020,2020,8,20,3.5,Outside
1.72926E+15,Marisa Maliram,8/20/2020 22:15,User,?.? ???????????????,8/20/2020,2020,8,20,3.5,
1.72926E+15,Marisa Maliram,8/20/2020 22:15,Admin,"?????????????? ?????????????????????????????????????????? ??
????????????????????????",8/20/2020,2020,8,20,3.5,Outside
1.79265E+15,????? ?????????,8/28/2020 18:57,User,?????????????????????????20000???,8/28/2020,2020,8,28,1.5,
1.79265E+15,????? ?????????,8/28/2020 18:57,Admin,??????????????????? ?????????????????????????????,8/28/2020,2020,8,28,1.5,Outside
1.79281E+15,Alle Jung,8/16/2020 20:41,User,097-1962607,8/16/2020,2020,8,16,3.5,
1.79281E+15,Alle Jung,8/16/2020 20:41,Admin,"??????????????????????????????????????????
??????????????????? 10 ????????? ???? ""0880880880""",8/16/2020,2020,8,16,3.5,Outside
1.80249E+15,????????? ??????,9/7/2020 14:20,Admin,?????? ????????????,9/7/2020,2020,9,7,6.5,
1.80249E+15,????????? ??????,9/7/2020 14:20,Admin,??????????????????????????????????,9/7/2020,2020,9,7,6.5,Outside
1.80249E+15,????????? ??????,9/7/2020 14:23,User,Cbr150r,9/7/2020,2020,9,7,8.5,
1.80249E+15,????????? ??????,9/7/2020 14:23,Admin,"??????????????????????????
?????? ??????
?????? ????
?? 2017",9/7/2020,2020,9,7,8.5,Outside
1.84599E+15,Toy Patcharaporn,8/13/2020 16:01,User,???????????????? ??????????????????????????? ?????? ?????????,8/13/2020,2020,8,13,3.5,
1.84599E+15,Toy Patcharaporn,8/13/2020 16:01,Admin,"??????????????????????????????????????????
??????????????????? 10 ????????? ???? ""0880880880""",8/13/2020,2020,8,13,3.5,Outside
1.84599E+15,Toy Patcharaporn,8/13/2020 16:01,User,??????????????????,8/13/2020,2020,8,13,3.5,
1.84599E+15,Toy Patcharaporn,8/13/2020 16:01,Admin,"?????????????? ?????????????????????????????????????????? ??
????????????????????????",8/13/2020,2020,8,13,3.5,Outside
1.84925E+15,???? ?????????,9/3/2020 14:53,User,087-5088098,9/3/2020,2020,9,3,3.5,
1.84925E+15,???? ?????????,9/3/2020 14:53,Admin,"??????????????????????????????????????????
??????????????????? 10 ?????????? ???? ""0880880880""",9/3/2020,2020,9,3,3.5,Outside
1.85865E+15,????????????? ??????????????,9/5/2020 11:50,User,2557,9/5/2020,2020,9,5,7.5,
1.85865E+15,????????????? ??????????????,9/5/2020 11:50,Admin,??????????????????????????????????????? ???? 2018,9/5/2020,2020,9,5,7.5,Outside
1.85865E+15,????????????? ??????????????,9/5/2020 11:58,Admin,?? ??,9/5/2020,2020,9,5,1.5,
1.85865E+15,????????????? ??????????????,9/5/2020 11:58,Admin,??????????????????? ?????????????????????????????,9/5/2020,2020,9,5,1.5,Outside
1.85865E+15,????????????? ??????????????,9/5/2020 12:08,Admin,?? ??,9/5/2020,2020,9,5,1.5,
1.85865E+15,????????????? ??????????????,9/5/2020 12:08,Admin,??????????????????? ?????????????????????????????,9/5/2020,2020,9,5,1.5,Outside
1.85865E+15,????????????? ??????????????,9/5/2020 12:08,User,???????????,9/5/2020,2020,9,5,2.5,
1.85865E+15,????????????? ??????????????,9/5/2020 12:08,Admin,??????? - ??????? ????????,9/5/2020,2020,9,5,2.5,Outside
1.85865E+15,????????????? ??????????????,9/5/2020 12:09,User,????????????????????????????,9/5/2020,2020,9,5,2.5,
1.85865E+15,????????????? ??????????????,9/5/2020 12:09,Admin,??????? - ??????? ????????,9/5/2020,2020,9,5,2.5,Outside
1.86128E+15,Narawadee Wechsawat,8/31/2020 10:45,User,??????????,8/31/2020,2020,8,31,1.5,
1.86128E+15,Narawadee Wechsawat,8/31/2020 10:45,Admin,??????????????????? ?????????????????????????????,8/31/2020,2020,8,31,1.5,Outside
1.86128E+15,Narawadee Wechsawat,8/31/2020 10:45,Admin,????????????????????????????????,8/31/2020,2020,8,31,1.5,
1.86128E+15,Narawadee Wechsawat,8/31/2020 10:45,Admin,??????????????????? ?????????????????????????????,8/31/2020,2020,8,31,1.5,Outside
1.87417E+15,?????????????? ??????????,8/12/2020 21:33,User,?????????????????????????,8/12/2020,2020,8,12,3.5,
1.87417E+15,?????????????? ??????????,8/12/2020 21:33,Admin,"??????????????????????????????????????????
??????????????????? 10 ????????? ???? ""0880880880""",8/12/2020,2020,8,12,3.5,Outside
1.88855E+15,Saran Phasuk,8/11/2020 7:58,Admin,?????? ?????????????,8/11/2020,2020,8,11,6.5,
1.88855E+15,Saran Phasuk,8/11/2020 7:58,Admin,?????????????????????????????????????,8/11/2020,2020,8,11,6.5,Outside
1.89201E+15,???????? ????????,8/6/2020 13:16,User,081-9185739?,8/6/2020,2020,8,6,3.5,
1.89201E+15,???????? ????????,8/6/2020 13:16,Admin,"??????????????????????????????????????????
??????????????????? 10 ????????? ???? ""0880880880""",8/6/2020,2020,8,6,3.5,Outside
1.89201E+15,???????? ????????,8/6/2020 13:17,Admin,???????????????????? ??????????????????????????????,8/6/2020,2020,8,6,3.5,
1.89201E+15,???????? ????????,8/6/2020 13:17,Admin,"?????????????? ?????????????????????????????????????????? ??
????????????????????????",8/6/2020,2020,8,6,3.5,Outside
1.89661E+15,?????????? ????????????,8/28/2020 21:21,User,??????,8/28/2020,2020,8,28,8.5,
1.89661E+15,?????????? ????????????,8/28/2020 21:21,Admin,"??????????????????????????
?????? ??????
?????? ????
?? 2015",8/28/2020,2020,8,28,8.5,Outside
1.89743E+15,??? ??????,8/12/2020 20:36,Admin,????????????????????????????????????,8/12/2020,2020,8,12,5.5,
1.89743E+15,??? ??????,8/12/2020 20:36,Admin,???????????????????????????????????????,8/12/2020,2020,8,12,5.5,Outside
1.89743E+15,??? ??????,8/12/2020 20:36,Admin,?????? ?????????????,8/12/2020,2020,8,12,6.5,
1.89743E+15,??? ??????,8/12/2020 20:36,Admin,?????????????????????????????????????,8/12/2020,2020,8,12,6.5,Outside
1.90109E+15,Waew First,9/3/2020 17:45,Admin,?? ??,9/3/2020,2020,9,3,1.5,
1.90109E+15,Waew First,9/3/2020 17:45,Admin,??????????????????? ?????????????????????????????,9/3/2020,2020,9,3,1.5,Outside
1.90109E+15,Waew First,9/3/2020 17:46,Admin,BTN_Creditcar2,9/3/2020,2020,9,3,1.5,
1.90109E+15,Waew First,9/3/2020 17:46,Admin,??????????????????? ?????????????????????????????,9/3/2020,2020,9,3,1.5,Outside
1.90732E+15,Wittaya Jaliya,8/23/2020 17:43,User,?????????????????????????,8/23/2020,2020,8,23,3.5,
1.90732E+15,Wittaya Jaliya,8/23/2020 17:43,Admin,"??????????????????????????????????????????
??????????????????? 10 ????????? ???? ""0880880880""",8/23/2020,2020,8,23,3.5,Outside
1.90732E+15,Wittaya Jaliya,8/23/2020 18:29,Admin,?????? ?????????????,8/23/2020,2020,8,23,6.5,
1.90732E+15,Wittaya Jaliya,8/23/2020 18:29,Admin,?????????????????????????????????????,8/23/2020,2020,8,23,6.5,Outside
1.91067E+15,Somjeez Kruarum,9/5/2020 16:26,Admin,BTN_Creditcar2,9/5/2020,2020,9,5,1.5,
1.91067E+15,Somjeez Kruarum,9/5/2020 16:26,Admin,??????????????????? ?????????????????????????????,9/5/2020,2020,9,5,1.5,Outside
1.91852E+15,??'? ????'?,8/14/2020 18:27,User,?,8/14/2020,2020,8,14,3.5,
1.91852E+15,??'? ????'?,8/14/2020 18:27,Admin,"??????????????????????????????????????????
??????????????????? 10 ????????? ???? ""0880880880""",8/14/2020,2020,8,14,3.5,Outside
1.92882E+15,Adisak Thongtang,9/2/2020 17:51,User,???????????,9/2/2020,2020,9,2,5.5,
1.92882E+15,Adisak Thongtang,9/2/2020 17:51,Admin,????????????????????????????????????,9/2/2020,2020,9,2,5.5,Outside
1.93131E+15,????????? ????????????,8/6/2020 11:57,User,?????????????????????????????? ??????????????????????????,8/6/2020,2020,8,6,3.5,
1.93131E+15,????????? ????????????,8/6/2020 11:57,Admin,"??????????????????????????????????????????
??????????????????? 10 ????????? ???? ""0880880880""",8/6/2020,2020,8,6,3.5,Outside
1.93131E+15,????????? ????????????,8/6/2020 11:57,User,?????????????????????,8/6/2020,2020,8,6,3.5,
1.93131E+15,????????? ????????????,8/6/2020 11:57,Admin,"?????????????? ?????????????????????????????????????????? ??
????????????????????????",8/6/2020,2020,8,6,3.5,Outside
1.93534E+15,Oum Love,9/1/2020 0:10,Admin,?? ??,9/1/2020,2020,9,1,1.5,
1.93534E+15,Oum Love,9/1/2020 0:10,Admin,??????????????????? ?????????????????????????????,9/1/2020,2020,9,1,1.5,Outside
1.93534E+15,Oum Love,9/1/2020 0:10,Admin,??????????????????? ?????????????????????????????,9/1/2020,2020,9,1,1.5,Outside
1.93534E+15,Oum Love,9/1/2020 0:10,Admin,??????????????????? ?????????????????????????????,9/1/2020,2020,9,1,1.5,Outside
1.94033E+15,??????? ???????,8/26/2020 9:28,User,????????????? ???????????????,8/26/2020,2020,8,26,3.5,
1.94033E+15,??????? ???????,8/26/2020 9:28,Admin,"??????????????????????????????????????????
??????????????????? 10 ????????? ???? ""0880880880""",8/26/2020,2020,8,26,3.5,Outside
1.94033E+15,??????? ???????,8/26/2020 9:29,User,???????????????,8/26/2020,2020,8,26,3.5,
1.94033E+15,??????? ???????,8/26/2020 9:29,Admin,"?????????????? ?????????????????????????????????????????? ??
????????????????????????",8/26/2020,2020,8,26,3.5,Outside
1.9407E+15,???????? naka,8/28/2020 19:16,Admin,?? ??,8/28/2020,2020,8,28,1.5,
1.9407E+15,???????? naka,8/28/2020 19:16,Admin,??????????????????? ?????????????????????????????,8/28/2020,2020,8,28,1.5,Outside
1.9407E+15,???????? naka,8/28/2020 19:16,Admin,??????????????????? ?????????????????????????????,8/28/2020,2020,8,28,1.5,Outside
1.9407E+15,???????? naka,8/28/2020 19:16,Admin,??????????????????? ?????????????????????????????,8/28/2020,2020,8,28,1.5,Outside
1.9534E+15,Dreaw Dry,8/20/2020 17:55,User,??? ????????,8/20/2020,2020,8,20,11.5,
1.9534E+15,Dreaw Dry,8/20/2020 17:55,Admin,"???????????????? ???????????????????? ???????????????????????? ??
(???????????? ?????)",8/20/2020,2020,8,20,11.5,Outside
1.95736E+15,????? ??????????,9/3/2020 10:43,User,?????????????????????????????????????,9/3/2020,2020,9,3,3.5,
1.95736E+15,????? ??????????,9/3/2020 10:43,Admin,"??????????????????????????????????????????
??????????????????? 10 ?????????? ???? ""0880880880""",9/3/2020,2020,9,3,3.5,Outside
1.95904E+15,???????? ???????,9/2/2020 20:01,User,?? 2552,9/2/2020,2020,9,2,7.5,
1.95904E+15,???????? ???????,9/2/2020 20:01,Admin,??????????????????????????????????????? ???? 2018,9/2/2020,2020,9,2,7.5,Outside
1.96183E+15,Kirati Wongtho,8/21/2020 22:29,User,096-6864208,8/21/2020,2020,8,21,3.5,
1.96183E+15,Kirati Wongtho,8/21/2020 22:29,Admin,"??????????????????????????????????????????
??????????????????? 10 ????????? ???? ""0880880880""",8/21/2020,2020,8,21,3.5,Outside
1.96183E+15,Kirati Wongtho,8/22/2020 9:28,User,???????????????????????????,8/22/2020,2020,8,22,3.5,
1.96183E+15,Kirati Wongtho,8/22/2020 9:28,Admin,"?????????????? ?????????????????????????????????????????? ??
????????????????????????",8/22/2020,2020,8,22,3.5,Outside
1.96378E+15,???????? ????? ?????? ??????,8/10/2020 9:56,User,??????????????????????????????????????????????,8/10/2020,2020,8,10,3.5,
1.96378E+15,???????? ????? ?????? ??????,8/10/2020 9:56,Admin,"??????????????????????????????????????????
??????????????????? 10 ????????? ???? ""0880880880""",8/10/2020,2020,8,10,3.5,Outside
1.96378E+15,???????? ????? ?????? ??????,8/10/2020 9:56,User,????????????????????????????,8/10/2020,2020,8,10,3.5,
1.96378E+15,???????? ????? ?????? ??????,8/10/2020 9:56,Admin,"?????????????? ?????????????????????????????????????????? ??
????????????????????????",8/10/2020,2020,8,10,3.5,Outside
1.96521E+15,Preeyanuch Puttajak,9/3/2020 5:08,User,???,9/3/2020,2020,9,3,4.5,
1.96521E+15,Preeyanuch Puttajak,9/3/2020 5:08,Admin,"????????????????????????
??????? ???????? ????????
?????????????? 0848950412",9/3/2020,2020,9,3,4.5,Outside
1.96552E+15,Pongsiri Maengpil,9/3/2020 14:12,User,??????????????,9/3/2020,2020,9,3,3.5,
1.96552E+15,Pongsiri Maengpil,9/3/2020 14:12,Admin,"??????????????????????????????????????????
??????????????????? 10 ?????????? ???? ""0880880880""",9/3/2020,2020,9,3,3.5,Outside
1.96552E+15,Pongsiri Maengpil,9/3/2020 14:19,User,?????????????,9/3/2020,2020,9,3,7.5,
1.96552E+15,Pongsiri Maengpil,9/3/2020 14:20,Admin,??????????????????????????????????????? ???? 2018,9/3/2020,2020,9,3,7.5,Outside
1.97416E+15,Noy Baidit Pimpila,9/4/2020 22:04,Admin,?????? ????????????,9/4/2020,2020,9,4,6.5,
1.97416E+15,Noy Baidit Pimpila,9/4/2020 22:04,Admin,??????????????????????????????????,9/4/2020,2020,9,4,6.5,Outside
1.98968E+15,??? ???,8/28/2020 17:15,Admin,CRS_Motorcycleloan2,8/28/2020,2020,8,28,1.5,
1.98968E+15,??? ???,8/28/2020 17:15,Admin,??????????????????? ?????????????????????????????,8/28/2020,2020,8,28,1.5,Outside
1.99215E+15,??????????????????????? ????,8/23/2020 12:02,Admin,?????? ?????????????,8/23/2020,2020,8,23,6.5,
1.99215E+15,??????????????????????? ????,8/23/2020 12:02,Admin,?????????????????????????????????????,8/23/2020,2020,8,23,6.5,Outside
1.99847E+15,?????? ???????,9/6/2020 14:12,Admin,????????????????????????????????????? ????????????????????? ??????????????????????????????????? 3 ??????? ????????????????????????????????????????,9/6/2020,2020,9,6,1.5,
1.99847E+15,?????? ???????,9/6/2020 14:12,Admin,??????????????????? ?????????????????????????????,9/6/2020,2020,9,6,1.5,Outside
1.99962E+15,????????? ???????,9/2/2020 15:08,User,?????????????? ???????????????????? ?????????????????????,9/2/2020,2020,9,2,3.5,
1.99962E+15,????????? ???????,9/2/2020 15:08,Admin,"??????????????????????????????????????????
??????????????????? 10 ?????????? ???? ""0880880880""",9/2/2020,2020,9,2,3.5,Outside
2.00508E+15,Nan Nan,8/19/2020 11:11,User,???????????????,8/19/2020,2020,8,19,3.5,
2.00508E+15,Nan Nan,8/19/2020 11:11,Admin,"??????????????????????????????????????????
??????????????????? 10 ????????? ???? ""0880880880""",8/19/2020,2020,8,19,3.5,Outside
2.00668E+15,?????? ???? ?????,9/2/2020 14:32,User,??????????????????,9/2/2020,2020,9,2,3.5,
2.00668E+15,?????? ???? ?????,9/2/2020 14:32,Admin,"??????????????????????????????????????????
??????????????????? 10 ????????? ???? ""0880880880""",9/2/2020,2020,9,2,3.5,Outside
2.00668E+15,?????? ???? ?????,9/2/2020 14:32,Admin,"?? ""??????"" ????????????????????????? ???????????????? ?????????????????????????",9/2/2020,2020,9,2,3.5,
2.00668E+15,?????? ???? ?????,9/2/2020 14:32,Admin,"?????????????? ?????????????????????????????????????????? ??
????????????????????????",9/2/2020,2020,9,2,3.5,Outside
2.01287E+15,?????????? ??? ??????,9/6/2020 7:30,Admin,CRS_Carinsurance2,9/6/2020,2020,9,6,1.5,
2.01287E+15,?????????? ??? ??????,9/6/2020 7:30,Admin,??????????????????? ?????????????????????????????,9/6/2020,2020,9,6,1.5,Outside
2.01437E+15,?????? ??????,9/3/2020 16:08,Admin,CRS_Carinsurance2,9/3/2020,2020,9,3,1.5,
2.01437E+15,?????? ??????,9/3/2020 16:08,Admin,??????????????????? ?????????????????????????????,9/3/2020,2020,9,3,1.5,Outside
2.0144E+15,Uussa MeesOok,8/13/2020 19:40,User,??????????? ????????????????????,8/13/2020,2020,8,13,3.5,
2.0144E+15,Uussa MeesOok,8/13/2020 19:40,Admin,"??????????????????????????????????????????
??????????????????? 10 ????????? ???? ""0880880880""",8/13/2020,2020,8,13,3.5,Outside
2.01512E+15,?????? ???????,8/8/2020 18:51,User,095-3865806,8/8/2020,2020,8,8,3.5,
2.01512E+15,?????? ???????,8/8/2020 18:51,Admin,"??????????????????????????????????????????
??????????????????? 10 ????????? ???? ""0880880880""",8/8/2020,2020,8,8,3.5,Outside
2.01982E+15,????????? ???????????,9/5/2020 14:57,Admin,"?? ""??????"" ?????",9/5/2020,2020,9,5,4.5,
2.01982E+15,????????? ???????????,9/5/2020 14:57,Admin,"????????????????????????
??????? ????????? ??????
?????????????? 0632986108",9/5/2020,2020,9,5,4.5,Outside
2.02016E+15,????? ???,8/26/2020 9:09,Admin,????????????????????????????????????,8/26/2020,2020,8,26,5.5,
2.02016E+15,????? ???,8/26/2020 9:09,Admin,???????????????????????????????????????,8/26/2020,2020,8,26,5.5,Outside
2.02016E+15,????? ???,8/26/2020 9:09,Admin,?????? ?????????????,8/26/2020,2020,8,26,6.5,
2.02016E+15,????? ???,8/26/2020 9:09,Admin,?????????????????????????????????????,8/26/2020,2020,8,26,6.5,Outside
2.02016E+15,????? ???,8/26/2020 9:10,Admin,?? ??,8/26/2020,2020,8,26,10.5,
2.02016E+15,????? ???,8/26/2020 9:10,Admin,??????????? ????????????????????????????????,8/26/2020,2020,8,26,10.5,Outside
2.02032E+15,N Baleeyai,8/24/2020 13:47,User,?.?????,8/24/2020,2020,8,24,11.5,
2.02032E+15,N Baleeyai,8/24/2020 13:47,Admin,"??????????????????? ???????????????????? ???????????????????????? ??
(???????????? ????????)",8/24/2020,2020,8,24,11.5,Outside
2.02046E+15,?????? ????????,8/29/2020 16:53,User,????????????????????? ?????????????????5???????????7???,8/29/2020,2020,8,29,1.5,
2.02046E+15,?????? ????????,8/29/2020 16:53,Admin,??????????????????? ?????????????????????????????,8/29/2020,2020,8,29,1.5,Outside
2.02751E+15,??????????? ????????,9/7/2020 10:08,Admin,IMG_Answer,9/7/2020,2020,9,7,1.5,
2.02751E+15,??????????? ????????,9/7/2020 10:08,Admin,??????????????????? ?????????????????????????????,9/7/2020,2020,9,7,1.5,Outside
2.02974E+15,Anugool Wangdonprai,8/29/2020 12:11,Admin,?? ??,8/29/2020,2020,8,29,1.5,
2.02974E+15,Anugool Wangdonprai,8/29/2020 12:11,Admin,??????????????????? ?????????????????????????????,8/29/2020,2020,8,29,1.5,Outside
2.02974E+15,Anugool Wangdonprai,8/29/2020 12:11,Admin,??????????????????? ?????????????????????????????,8/29/2020,2020,8,29,1.5,Outside
2.02974E+15,Anugool Wangdonprai,8/29/2020 12:11,Admin,??????????????????? ?????????????????????????????,8/29/2020,2020,8,29,1.5,Outside
2.03363E+15,?????? ?????????,8/21/2020 12:04,User,099-1489990,8/21/2020,2020,8,21,3.5,
2.03363E+15,?????? ?????????,8/21/2020 12:04,Admin,"??????????????????????????????????????????
??????????????????? 10 ????????? ???? ""0880880880""",8/21/2020,2020,8,21,3.5,Outside
2.04711E+15,Sowut Onpan,8/14/2020 10:13,User,??????????????????????,8/14/2020,2020,8,14,3.5,
2.04711E+15,Sowut Onpan,8/14/2020 10:13,Admin,"??????????????????????????????????????????
??????????????????? 10 ????????? ???? ""0880880880""",8/14/2020,2020,8,14,3.5,Outside
2.05751E+15,Nirut Rungwattana,8/23/2020 6:25,Admin,???????????????????????????????,8/23/2020,2020,8,23,5.5,
2.05751E+15,Nirut Rungwattana,8/23/2020 6:25,Admin,???????????????????????????????????????,8/23/2020,2020,8,23,5.5,Outside
2.05904E+15,???????? ????????????,8/18/2020 8:10,User,msx .5 ???????????????????????,8/18/2020,2020,8,18,3.5,
2.05904E+15,???????? ????????????,8/18/2020 8:10,Admin,"??????????????????????????????????????????
??????????????????? 10 ????????? ???? ""0880880880""",8/18/2020,2020,8,18,3.5,Outside
2.05904E+15,???????? ????????????,8/18/2020 8:11,User,081-869-1293,8/18/2020,2020,8,18,3.5,
2.05904E+15,???????? ????????????,8/18/2020 8:11,Admin,"?????????????? ?????????????????????????????????????????? ??
????????????????????????",8/18/2020,2020,8,18,3.5,Outside
2.06071E+15,????? ??????,8/13/2020 21:16,User,????125?????????,8/13/2020,2020,8,13,5.5,
2.06071E+15,????? ??????,8/13/2020 21:17,Admin,???????????????????????????????????????,8/13/2020,2020,8,13,5.5,Outside
2.06071E+15,????? ??????,8/13/2020 21:18,Admin,?????? ?????????????,8/13/2020,2020,8,13,6.5,
2.06071E+15,????? ??????,8/13/2020 21:18,Admin,?????????????????????????????????????,8/13/2020,2020,8,13,6.5,Outside
2.06446E+15,???? '??????,8/23/2020 15:43,User,??????? ????????????? ???????????,8/23/2020,2020,8,23,3.5,
2.06446E+15,???? '??????,8/23/2020 15:43,Admin,"??????????????????????????????????????????
??????????????????? 10 ????????? ???? ""0880880880""",8/23/2020,2020,8,23,3.5,Outside
2.06446E+15,???? '??????,8/23/2020 15:43,User,?????????????????,8/23/2020,2020,8,23,3.5,
2.06446E+15,???? '??????,8/23/2020 15:43,Admin,"?????????????? ?????????????????????????????????????????? ??
????????????????????????",8/23/2020,2020,8,23,3.5,Outside
2.0755E+15,????' ????'??,8/10/2020 14:41,Admin,IMG_greeting,8/10/2020,2020,8,10,3.5,
2.0755E+15,????' ????'??,8/10/2020 14:41,Admin,"??????????????????????????????????????????
??????????????????? 10 ????????? ???? ""0880880880""",8/10/2020,2020,8,10,3.5,Outside
2.0755E+15,????' ????'??,8/10/2020 14:47,User,"{""type"":""legacy_reply_to_message_action"",""message"":""Start Talking""}",8/10/2020,2020,8,10,3.5,
2.0755E+15,????' ????'??,8/10/2020 14:47,Admin,"?????????????? ?????????????????????????????????????????? ??
????????????????????????",8/10/2020,2020,8,10,3.5,Outside
2.0798E+15,Jiraphak Nantanit,8/30/2020 22:40,User,??????????????? ????????? 4 ?????,8/30/2020,2020,8,30,3.5,
2.0798E+15,Jiraphak Nantanit,8/30/2020 22:40,Admin,"??????????????????????????????????????????
??????????????????? 10 ?????????? ???? ""0880880880""",8/30/2020,2020,8,30,3.5,Outside
2.0798E+15,Jiraphak Nantanit,8/30/2020 22:41,User,095-8023794,8/30/2020,2020,8,30,3.5,
2.0798E+15,Jiraphak Nantanit,8/30/2020 22:41,Admin,"?????????????? ?????????????????????????????????????????? ??
?????????????????????????",8/30/2020,2020,8,30,3.5,Outside
2.0844E+15,?????????? ???????????????,9/3/2020 21:31,Admin,IMG_Answer,9/3/2020,2020,9,3,1.5,
2.0844E+15,?????????? ???????????????,9/3/2020 21:31,Admin,??????????????????? ?????????????????????????????,9/3/2020,2020,9,3,1.5,Outside
2.08745E+15,Oilly Suphitchaya,8/15/2020 15:56,User,???,8/15/2020,2020,8,15,3.5,
2.08745E+15,Oilly Suphitchaya,8/15/2020 15:56,Admin,"??????????????????????????????????????????
??????????????????? 10 ????????? ???? ""0880880880""",8/15/2020,2020,8,15,3.5,Outside
2.08745E+15,Oilly Suphitchaya,8/15/2020 15:56,User,??????,8/15/2020,2020,8,15,3.5,
2.08745E+15,Oilly Suphitchaya,8/15/2020 15:56,Admin,"?????????????? ?????????????????????????????????????????? ??
????????????????????????",8/15/2020,2020,8,15,3.5,Outside
2.09562E+15,????'?????? ?????????????????,9/3/2020 2:17,User,"???????????????5,000????????????????????????????????????????",9/3/2020,2020,9,3,1.5,
2.09562E+15,????'?????? ?????????????????,9/3/2020 2:17,Admin,??????????????????? ?????????????????????????????,9/3/2020,2020,9,3,1.5,Outside
2.09946E+15,Praphon Tantiviwatkul,9/4/2020 4:54,User,backform$ilent,9/4/2020,2020,9,4,3.5,
2.09946E+15,Praphon Tantiviwatkul,9/4/2020 4:54,Admin,"????????????????????? ???????????????????
( ?????????????? 10 ???? ???? 0880880880 )",9/4/2020,2020,9,4,3.5,Outside
2.09946E+15,Praphon Tantiviwatkul,9/4/2020 4:56,User,????????????????????? ???????????????????? ????????????????????? ??????????????????????????????????? 14 ????????????????????,9/4/2020,2020,9,4,3.5,
2.09946E+15,Praphon Tantiviwatkul,9/4/2020 4:56,Admin,"??????????????????????????????????????????
??????????????????? 10 ?????????? ???? ""0880880880""",9/4/2020,2020,9,4,3.5,Outside
2.10246E+15,Padtama Loesphan,9/2/2020 14:01,Admin,CRS_Carinsurance2,9/2/2020,2020,9,2,1.5,
2.10246E+15,Padtama Loesphan,9/2/2020 14:01,Admin,??????????????????? ?????????????????????????????,9/2/2020,2020,9,2,1.5,Outside
2.11079E+15,Suviwat Sophon Watcharakul,9/2/2020 19:57,User,??????????,9/2/2020,2020,9,2,1.5,
2.11079E+15,Suviwat Sophon Watcharakul,9/2/2020 19:57,Admin,??????????????????? ?????????????????????????????,9/2/2020,2020,9,2,1.5,Outside
2.1182E+15,Nat Nat,8/11/2020 22:22,Admin,????????????????????????????????????,8/11/2020,2020,8,11,5.5,
2.1182E+15,Nat Nat,8/11/2020 22:22,Admin,???????????????????????????????????????,8/11/2020,2020,8,11,5.5,Outside
2.1316E+15,???????? ????????,8/8/2020 16:43,User,?????????,8/8/2020,2020,8,8,12.5,
2.1316E+15,???????? ????????,8/8/2020 16:43,Admin,"?????????????????? ???????????????????? ???????????????????????? ??
(???????????? ????????)",8/8/2020,2020,8,8,12.5,Outside
2.13364E+15,??????? ???????????,9/1/2020 17:40,User,???????  ?????????,9/1/2020,2020,9,1,3.5,
2.13364E+15,??????? ???????????,9/1/2020 17:40,Admin,"??????????????????????????????????????????
??????????????????? 10 ?????????? ???? ""0880880880""",9/1/2020,2020,9,1,3.5,Outside
2.1359E+15,Mawit Agsornthai,8/17/2020 15:22,Admin,?????? ?????????????,8/17/2020,2020,8,17,6.5,
2.1359E+15,Mawit Agsornthai,8/17/2020 15:22,Admin,?????????????????????????????????????,8/17/2020,2020,8,17,6.5,Outside
2.1359E+15,Mawit Agsornthai,8/17/2020 15:28,Admin,?????? ?????????????,8/17/2020,2020,8,17,6.5,
2.1359E+15,Mawit Agsornthai,8/17/2020 15:28,Admin,?????????????????????????????????????,8/17/2020,2020,8,17,6.5,Outside
2.14916E+15,Anchana Jitwate,8/31/2020 13:32,User,????????,8/31/2020,2020,8,31,7.5,
2.14916E+15,Anchana Jitwate,8/31/2020 13:32,Admin,??????????????????????????????????????? ???? 2018,8/31/2020,2020,8,31,7.5,Outside
2.15611E+15,??? ????????,9/6/2020 21:18,Admin,?? ??,9/6/2020,2020,9,6,1.5,
2.15611E+15,??? ????????,9/6/2020 21:18,Admin,??????????????????? ?????????????????????????????,9/6/2020,2020,9,6,1.5,Outside
2.15611E+15,??? ????????,9/6/2020 21:18,Admin,??????????????????? ?????????????????????????????,9/6/2020,2020,9,6,1.5,Outside
2.15611E+15,??? ????????,9/6/2020 21:18,Admin,??????????????????? ?????????????????????????????,9/6/2020,2020,9,6,1.5,Outside
2.15611E+15,??? ????????,9/6/2020 21:19,Admin,CRS_Carinsurance2,9/6/2020,2020,9,6,1.5,
2.15611E+15,??? ????????,9/6/2020 21:19,Admin,??????????????????? ?????????????????????????????,9/6/2020,2020,9,6,1.5,Outside
2.15611E+15,??? ????????,9/6/2020 21:21,User,60,9/6/2020,2020,9,6,7.5,
2.15611E+15,??? ????????,9/6/2020 21:21,Admin,??????????????????????????????????????? ???? 2018,9/6/2020,2020,9,6,7.5,Outside
2.15886E+15,Veerachat Love,8/10/2020 0:03,Admin,???????????????????????????????????????? ??????????????????????????????????,8/10/2020,2020,8,10,5.5,
2.15886E+15,Veerachat Love,8/10/2020 0:03,Admin,???????????????????????????????????????,8/10/2020,2020,8,10,5.5,Outside
2.15904E+15,Preecha Asenal,9/7/2020 10:36,User,backform$ilent,9/7/2020,2020,9,7,1.5,
2.15904E+15,Preecha Asenal,9/7/2020 10:36,Admin,??????????????????? ?????????????????????????????,9/7/2020,2020,9,7,1.5,Outside
2.15904E+15,Preecha Asenal,9/7/2020 10:37,Admin,CRS_Carinsurance2,9/7/2020,2020,9,7,1.5,
2.15904E+15,Preecha Asenal,9/7/2020 10:37,Admin,??????????????????? ?????????????????????????????,9/7/2020,2020,9,7,1.5,Outside
2.16261E+15,????????? ??????????????????,9/6/2020 21:38,User,?????????,9/6/2020,2020,9,6,1.5,
2.16261E+15,????????? ??????????????????,9/6/2020 21:38,Admin,??????????????????? ?????????????????????????????,9/6/2020,2020,9,6,1.5,Outside
2.16428E+15,Bee Bes Phatarapron,8/15/2020 5:41,User,??????????????????????????????????????????????,8/15/2020,2020,8,15,3.5,
2.16428E+15,Bee Bes Phatarapron,8/15/2020 5:41,Admin,"??????????????????????????????????????????
??????????????????? 10 ????????? ???? ""0880880880""",8/15/2020,2020,8,15,3.5,Outside
2.16672E+15,Samrit Srikaewkul,8/30/2020 21:11,Admin,?? ??,8/30/2020,2020,8,30,1.5,
2.16672E+15,Samrit Srikaewkul,8/30/2020 21:11,Admin,??????????????????? ?????????????????????????????,8/30/2020,2020,8,30,1.5,Outside
2.17701E+15,Happy Good,8/23/2020 16:30,User,?????????????????????????????????,8/23/2020,2020,8,23,3.5,
2.17701E+15,Happy Good,8/23/2020 16:30,Admin,"??????????????????????????????????????????
??????????????????? 10 ????????? ???? ""0880880880""",8/23/2020,2020,8,23,3.5,Outside
2.18093E+15,Natthanicha Kh,8/31/2020 14:53,User,??????????????????,8/31/2020,2020,8,31,4.5,
2.18093E+15,Natthanicha Kh,8/31/2020 14:53,Admin,"????????????????????????
??????? ???????????????
?????????????? 0954571864",8/31/2020,2020,8,31,4.5,Outside
2.18361E+15,??? ?????,8/5/2020 12:29,User,0899648742????,8/5/2020,2020,8,5,3.5,
2.18361E+15,??? ?????,8/5/2020 12:29,Admin,"??????????????????????????????????????????
??????????????????? 10 ????????? ???? ""0880880880""",8/5/2020,2020,8,5,3.5,Outside
2.18361E+15,??? ?????,8/5/2020 12:30,Admin,?????? ?????????????,8/5/2020,2020,8,5,6.5,
2.18361E+15,??? ?????,8/5/2020 12:30,Admin,?????????????????????????????????????,8/5/2020,2020,8,5,6.5,Outside
2.18361E+15,??? ?????,8/5/2020 12:33,User,?????????????,8/5/2020,2020,8,5,11.5,
2.18361E+15,??? ?????,8/5/2020 12:33,Admin,"???????????????? ???????????????????? ???????????????????????? ??
(???????????? ?????)",8/5/2020,2020,8,5,11.5,Outside
2.19073E+15,??? ??????,9/5/2020 23:39,User,???????,9/5/2020,2020,9,5,3.5,
2.19073E+15,??? ??????,9/5/2020 23:39,Admin,"??????????????????????????????????????????
??????????????????? 10 ?????????? ???? ""0880880880""",9/5/2020,2020,9,5,3.5,Outside
2.19073E+15,??? ??????,9/5/2020 23:39,User,??????????,9/5/2020,2020,9,5,3.5,
2.19073E+15,??? ??????,9/5/2020 23:39,Admin,"?????????????? ?????????????????????????????????????????? ??
?????????????????????????",9/5/2020,2020,9,5,3.5,Outside
2.19547E+15,?? ???????,8/11/2020 7:47,Admin,?????? ?????????????,8/11/2020,2020,8,11,6.5,
2.19547E+15,?? ???????,8/11/2020 7:47,Admin,?????????????????????????????????????,8/11/2020,2020,8,11,6.5,Outside
2.19601E+15,???? ????????,8/30/2020 0:21,Admin,?????? ????????????,8/30/2020,2020,8,30,6.5,
2.19601E+15,???? ????????,8/30/2020 0:21,Admin,??????????????????????????????????,8/30/2020,2020,8,30,6.5,Outside
2.19601E+15,???? ????????,8/30/2020 0:21,User,Swift,8/30/2020,2020,8,30,6.5,
2.19601E+15,???? ????????,8/30/2020 0:21,Admin,??????????????????????????????????,8/30/2020,2020,8,30,6.5,Outside
2.19601E+15,???? ????????,8/30/2020 0:27,Admin,?????? ????????????,8/30/2020,2020,8,30,6.5,
2.19601E+15,???? ????????,8/30/2020 0:27,Admin,??????????????????????????????????,8/30/2020,2020,8,30,6.5,Outside
2.19601E+15,???? ????????,8/30/2020 0:27,User,????,8/30/2020,2020,8,30,6.5,
2.19601E+15,???? ????????,8/30/2020 0:27,Admin,??????????????????????????????????,8/30/2020,2020,8,30,6.5,Outside
2.19601E+15,???? ????????,8/30/2020 0:28,Admin,?????? ????????????,8/30/2020,2020,8,30,6.5,
2.19601E+15,???? ????????,8/30/2020 0:28,Admin,??????????????????????????????????,8/30/2020,2020,8,30,6.5,Outside
2.20225E+15,Napat Sricharoen,8/23/2020 14:31,User,????????????5-6??????,8/23/2020,2020,8,23,3.5,
2.20225E+15,Napat Sricharoen,8/23/2020 14:31,Admin,"??????????????????????????????????????????
??????????????????? 10 ????????? ???? ""0880880880""",8/23/2020,2020,8,23,3.5,Outside
2.20443E+15,Jittraporn Jandawong,8/28/2020 13:44,User,?????,8/28/2020,2020,8,28,2.5,
2.20443E+15,Jittraporn Jandawong,8/28/2020 13:44,Admin,??????? - ??????? ????????,8/28/2020,2020,8,28,2.5,Outside
2.20443E+15,Jittraporn Jandawong,8/28/2020 13:44,User,?????????? ?????????,8/28/2020,2020,8,28,3.5,
2.20443E+15,Jittraporn Jandawong,8/28/2020 13:44,Admin,"????????????????????? ???????????????????
( ?????????????? 10 ???? ???? 0880880880 )",8/28/2020,2020,8,28,3.5,Outside
2.20443E+15,Jittraporn Jandawong,8/28/2020 13:45,Admin,?????? ????????????,8/28/2020,2020,8,28,6.5,
2.20443E+15,Jittraporn Jandawong,8/28/2020 13:45,Admin,??????????????????????????????????,8/28/2020,2020,8,28,6.5,Outside
2.20443E+15,Jittraporn Jandawong,8/28/2020 13:49,User,????????58,8/28/2020,2020,8,28,7.5,
2.20443E+15,Jittraporn Jandawong,8/28/2020 13:49,Admin,??????????????????????????????????????? ???? 2018,8/28/2020,2020,8,28,7.5,Outside
2.20443E+15,Jittraporn Jandawong,8/28/2020 13:54,Admin,IMG_Privatepolicy,8/28/2020,2020,8,28,9.5,
2.20443E+15,Jittraporn Jandawong,8/28/2020 13:54,Admin,??????????????????????????????,8/28/2020,2020,8,28,9.5,Outside
2.20609E+15,????? ????????,8/20/2020 8:56,User,??????,8/20/2020,2020,8,20,11.5,
2.20609E+15,????? ????????,8/20/2020 8:56,Admin,"??????????????????? ???????????????????? ???????????????????????? ??
(???????????? ????????)",8/20/2020,2020,8,20,11.5,Outside
2.21004E+15,Amnuat Chaiyarut,8/7/2020 16:35,User,????????????????,8/7/2020,2020,8,7,3.5,
2.21004E+15,Amnuat Chaiyarut,8/7/2020 16:35,Admin,"??????????????????????????????????????????
??????????????????? 10 ????????? ???? ""0880880880""",8/7/2020,2020,8,7,3.5,Outside
2.21004E+15,Amnuat Chaiyarut,8/7/2020 16:37,User,?????????????????????????????,8/7/2020,2020,8,7,3.5,
2.21004E+15,Amnuat Chaiyarut,8/7/2020 16:37,Admin,"?????????????? ?????????????????????????????????????????? ??
????????????????????????",8/7/2020,2020,8,7,3.5,Outside
2.21118E+15,Thanitarat Thonglor,9/5/2020 20:23,Admin,CRS_Carinsurance2,9/5/2020,2020,9,5,1.5,
2.21118E+15,Thanitarat Thonglor,9/5/2020 20:23,Admin,??????????????????? ?????????????????????????????,9/5/2020,2020,9,5,1.5,Outside
2.21218E+15,Aon Chot,9/1/2020 10:54,User,?????????,9/1/2020,2020,9,1,7.5,
2.21218E+15,Aon Chot,9/1/2020 10:54,Admin,??????????????????????????????????????? ???? 2018,9/1/2020,2020,9,1,7.5,Outside
2.21484E+15,Hus Be'e,8/24/2020 19:49,Admin,???????????????????? ??????????????????????????????,8/24/2020,2020,8,24,3.5,
2.21484E+15,Hus Be'e,8/24/2020 19:49,Admin,"??????????????????????????????????????????
??????????????????? 10 ????????? ???? ""0880880880""",8/24/2020,2020,8,24,3.5,Outside
2.21484E+15,Hus Be'e,8/24/2020 19:49,User,??????? 2018,8/24/2020,2020,8,24,3.5,
2.21484E+15,Hus Be'e,8/24/2020 19:49,Admin,"?????????????? ?????????????????????????????????????????? ??
????????????????????????",8/24/2020,2020,8,24,3.5,Outside
2.21604E+15,???? ??????,9/4/2020 15:42,User,???????????????????,9/4/2020,2020,9,4,1.5,
2.21604E+15,???? ??????,9/4/2020 15:42,Admin,??????????????????? ?????????????????????????????,9/4/2020,2020,9,4,1.5,Outside
2.21846E+15,Nuchy Smile,8/13/2020 16:42,User,?????????????????????????????????,8/13/2020,2020,8,13,3.5,
2.21846E+15,Nuchy Smile,8/13/2020 16:42,Admin,"??????????????????????????????????????????
??????????????????? 10 ????????? ???? ""0880880880""",8/13/2020,2020,8,13,3.5,Outside
2.21846E+15,Nuchy Smile,8/13/2020 16:42,User,????????????????????????????,8/13/2020,2020,8,13,3.5,
2.21846E+15,Nuchy Smile,8/13/2020 16:42,Admin,"?????????????? ?????????????????????????????????????????? ??
????????????????????????",8/13/2020,2020,8,13,3.5,Outside
2.21992E+15,??????? ?????????,9/5/2020 13:43,User,??????????????????????????,9/5/2020,2020,9,5,7.5,
2.21992E+15,??????? ?????????,9/5/2020 13:43,Admin,??????????????????????????????????????? ???? 2018,9/5/2020,2020,9,5,7.5,Outside
2.21992E+15,??????? ?????????,9/5/2020 14:55,Admin,?? ??,9/5/2020,2020,9,5,1.5,
2.21992E+15,??????? ?????????,9/5/2020 14:55,Admin,??????????????????? ?????????????????????????????,9/5/2020,2020,9,5,1.5,Outside
2.21992E+15,??????? ?????????,9/5/2020 14:55,User,???????????,9/5/2020,2020,9,5,2.5,
2.21992E+15,??????? ?????????,9/5/2020 14:55,Admin,??????? - ??????? ????????,9/5/2020,2020,9,5,2.5,Outside
2.21992E+15,??????? ?????????,9/5/2020 14:56,User,?????????? ????????,9/5/2020,2020,9,5,3.5,
2.21992E+15,??????? ?????????,9/5/2020 14:56,Admin,"????????????????????? ???????????????????
( ?????????????? 10 ???? ???? 0880880880 )",9/5/2020,2020,9,5,3.5,Outside
2.21992E+15,??????? ?????????,9/5/2020 14:56,User,920619990,9/5/2020,2020,9,5,4.5,
2.21992E+15,??????? ?????????,9/5/2020 14:56,Admin,"????????????????????????
??????? ?????????? ????????
?????????????? 0920619990",9/5/2020,2020,9,5,4.5,Outside
2.21992E+15,??????? ?????????,9/5/2020 14:56,Admin,?????????????????????????????????????,9/5/2020,2020,9,5,5.5,
2.21992E+15,??????? ?????????,9/5/2020 14:56,Admin,????????????????????????????????????,9/5/2020,2020,9,5,5.5,Outside
2.21992E+15,??????? ?????????,9/5/2020 14:56,Admin,?????? ????????????,9/5/2020,2020,9,5,6.5,
2.21992E+15,??????? ?????????,9/5/2020 14:56,Admin,??????????????????????????????????,9/5/2020,2020,9,5,6.5,Outside
2.22033E+15,Nung Rodchiang,8/5/2020 3:42,Admin,????????????????????????????????????????,8/5/2020,2020,8,5,6.5,
2.22033E+15,Nung Rodchiang,8/5/2020 3:42,Admin,?????????????????????????????????????,8/5/2020,2020,8,5,6.5,Outside
2.2217E+15,?? ???????????????,8/9/2020 18:42,User,????????????????,8/9/2020,2020,8,9,5.5,
2.2217E+15,?? ???????????????,8/9/2020 18:42,Admin,???????????????????????????????????????,8/9/2020,2020,8,9,5.5,Outside
2.22224E+15,????????????? ?????????????????????,8/14/2020 17:46,Admin,BTN_Creditcar2,8/14/2020,2020,8,14,5.5,
2.22224E+15,????????????? ?????????????????????,8/14/2020 17:46,Admin,???????????????????????????????????????,8/14/2020,2020,8,14,5.5,Outside
2.22473E+15,?????? ???,9/1/2020 20:27,Admin,CRS_Carinsurance2,9/1/2020,2020,9,1,1.5,
2.22473E+15,?????? ???,9/1/2020 20:27,Admin,??????????????????? ?????????????????????????????,9/1/2020,2020,9,1,1.5,Outside
2.22473E+15,?????? ???,9/1/2020 20:29,Admin,?????? ????????????,9/1/2020,2020,9,1,6.5,
2.22473E+15,?????? ???,9/1/2020 20:29,Admin,??????????????????????????????????,9/1/2020,2020,9,1,6.5,Outside
2.23469E+15,??????? ??????,9/5/2020 7:35,User,??????? ??????,9/5/2020,2020,9,5,3.5,
2.23469E+15,??????? ??????,9/5/2020 7:35,Admin,"??????????????????????????????????????????
??????????????????? 10 ?????????? ???? ""0880880880""",9/5/2020,2020,9,5,3.5,Outside
2.23988E+15,?????'????????' ???????????????,9/5/2020 20:36,User,??????,9/5/2020,2020,9,5,1.5,
2.23988E+15,?????'????????' ???????????????,9/5/2020 20:36,Admin,??????????????????? ?????????????????????????????,9/5/2020,2020,9,5,1.5,Outside
2.24268E+15,Thirayut Chain,8/31/2020 18:13,User,??????????????????????,8/31/2020,2020,8,31,1.5,
2.24268E+15,Thirayut Chain,8/31/2020 18:13,Admin,??????????????????? ?????????????????????????????,8/31/2020,2020,8,31,1.5,Outside
2.2434E+15,Bussayamas Intawong,8/29/2020 17:39,Admin,CRS_Carinsurance2,8/29/2020,2020,8,29,1.5,
2.2434E+15,Bussayamas Intawong,8/29/2020 17:39,Admin,??????????????????? ?????????????????????????????,8/29/2020,2020,8,29,1.5,Outside
2.24517E+15,???? ??????,8/28/2020 19:39,User,????????????????????????????????,8/28/2020,2020,8,28,11.5,
2.24517E+15,???? ??????,8/28/2020 19:39,Admin,"??????????????????? ???????????????????? ???????????????????????? ??
(???????????? ????????)",8/28/2020,2020,8,28,11.5,Outside
2.24619E+15,Warattaya Jaree,8/7/2020 13:17,User,?????? ????,8/7/2020,2020,8,7,3.5,
2.24619E+15,Warattaya Jaree,8/7/2020 13:17,Admin,"??????????????????????????????????????????
??????????????????? 10 ????????? ???? ""0880880880""",8/7/2020,2020,8,7,3.5,Outside
2.24668E+15,Wipawan Itsarangkun,8/10/2020 20:22,Admin,CRS_Motorcycleloan2,8/10/2020,2020,8,10,6.5,
2.24668E+15,Wipawan Itsarangkun,8/10/2020 20:22,Admin,?????????????????????????????????????,8/10/2020,2020,8,10,6.5,Outside
2.24717E+15,?????? ??.,9/3/2020 9:16,User,?????? ?????????. ?????,9/3/2020,2020,9,3,2.5,
2.24717E+15,?????? ??.,9/3/2020 9:16,Admin,??????? - ??????? ????????,9/3/2020,2020,9,3,2.5,Outside
2.24736E+15,Patcharaporn Donnam,9/1/2020 20:03,Admin,IMG_Answer,9/1/2020,2020,9,1,5.5,
2.24736E+15,Patcharaporn Donnam,9/1/2020 20:03,Admin,????????????????????????????????????,9/1/2020,2020,9,1,5.5,Outside
2.24736E+15,Patcharaporn Donnam,9/1/2020 20:03,Admin,?????? ????????????,9/1/2020,2020,9,1,6.5,
2.24736E+15,Patcharaporn Donnam,9/1/2020 20:03,Admin,??????????????????????????????????,9/1/2020,2020,9,1,6.5,Outside
2.2511E+15,?????? '??????,9/1/2020 10:40,User,???????????????????????????????????????,9/1/2020,2020,9,1,4.5,
2.2511E+15,?????? '??????,9/1/2020 10:40,Admin,"????????????????????????
??????? ???????????????
?????????????? 0822901970",9/1/2020,2020,9,1,4.5,Outside
2.2511E+15,?????? '??????,9/1/2020 10:41,User,?????,9/1/2020,2020,9,1,2.5,
2.2511E+15,?????? '??????,9/1/2020 10:41,Admin,??????? - ??????? ????????,9/1/2020,2020,9,1,2.5,Outside
2.2511E+15,?????? '??????,9/1/2020 10:41,User,????? ?????????,9/1/2020,2020,9,1,3.5,
2.2511E+15,?????? '??????,9/1/2020 10:41,Admin,"????????????????????? ???????????????????
( ?????????????? 10 ???? ???? 0880880880 )",9/1/2020,2020,9,1,3.5,Outside
2.25266E+15,????' ????????.,8/27/2020 9:32,User,0829500122?,8/27/2020,2020,8,27,3.5,
2.25266E+15,????' ????????.,8/27/2020 9:32,Admin,"??????????????????????????????????????????
??????????????????? 10 ????????? ???? ""0880880880""",8/27/2020,2020,8,27,3.5,Outside
2.25756E+15,Din Thorani,9/5/2020 8:10,Admin,"?? ""??????"" ?????",9/5/2020,2020,9,5,8.5,
2.25756E+15,Din Thorani,9/5/2020 8:10,Admin,"??????????????????????????
?????? ??????
?????? ??? 110
?? 2015",9/5/2020,2020,9,5,8.5,Outside
2.25756E+15,Din Thorani,9/5/2020 8:12,User,?.???????????????,9/5/2020,2020,9,5,11.5,
2.25756E+15,Din Thorani,9/5/2020 8:12,Admin,"??????????????????? ???????????????????? ???????????????????????? ??
(???????????? ????????)",9/5/2020,2020,9,5,11.5,Outside
2.25766E+15,?.? ?????? ???????????,9/1/2020 18:14,User,095-8279553,9/1/2020,2020,9,1,3.5,
2.25766E+15,?.? ?????? ???????????,9/1/2020 18:14,Admin,"??????????????????????????????????????????
??????????????????? 10 ?????????? ???? ""0880880880""",9/1/2020,2020,9,1,3.5,Outside
2.25766E+15,?.? ?????? ???????????,9/1/2020 18:20,User,?.??????????,9/1/2020,2020,9,1,11.5,
2.25766E+15,?.? ?????? ???????????,9/1/2020 18:20,Admin,"??????????????????? ???????????????????? ???????????????????????? ??
(???????????? ????????)",9/1/2020,2020,9,1,11.5,Outside
2.2604E+15,None None,8/19/2020 16:04,User,??????????????????,8/19/2020,2020,8,19,3.5,
2.2604E+15,None None,8/19/2020 16:04,Admin,"??????????????????????????????????????????
??????????????????? 10 ????????? ???? ""0880880880""",8/19/2020,2020,8,19,3.5,Outside
2.2604E+15,None None,8/19/2020 16:04,User,????????????????????????????,8/19/2020,2020,8,19,3.5,
2.2604E+15,None None,8/19/2020 16:04,Admin,"?????????????? ?????????????????????????????????????????? ??
????????????????????????",8/19/2020,2020,8,19,3.5,Outside
2.26228E+15,Tasanai Tasanai,8/23/2020 21:45,User,????????????????????????????????,8/23/2020,2020,8,23,3.5,
2.26228E+15,Tasanai Tasanai,8/23/2020 21:45,Admin,"??????????????????????????????????????????
??????????????????? 10 ????????? ???? ""0880880880""",8/23/2020,2020,8,23,3.5,Outside
2.26271E+15,???? ?????????????,9/5/2020 20:03,Admin,?? ??,9/5/2020,2020,9,5,1.5,
2.26271E+15,???? ?????????????,9/5/2020 20:03,Admin,??????????????????? ?????????????????????????????,9/5/2020,2020,9,5,1.5,Outside
2.26271E+15,???? ?????????????,9/5/2020 20:03,Admin,??????????????????? ?????????????????????????????,9/5/2020,2020,9,5,1.5,Outside
2.26271E+15,???? ?????????????,9/5/2020 20:03,Admin,??????????????????? ?????????????????????????????,9/5/2020,2020,9,5,1.5,Outside
2.26334E+15,Kanyarat Sueroj,9/7/2020 6:55,Admin,?? ??,9/7/2020,2020,9,7,1.5,
2.26334E+15,Kanyarat Sueroj,9/7/2020 6:55,Admin,??????????????????? ?????????????????????????????,9/7/2020,2020,9,7,1.5,Outside
2.26334E+15,Kanyarat Sueroj,9/7/2020 6:56,User,?????????,9/7/2020,2020,9,7,2.5,
2.26334E+15,Kanyarat Sueroj,9/7/2020 6:56,Admin,??????? - ??????? ????????,9/7/2020,2020,9,7,2.5,Outside
2.27266E+15,??? ???,8/25/2020 19:23,User,??????????????????????????????,8/25/2020,2020,8,25,3.5,
2.27266E+15,??? ???,8/25/2020 19:23,Admin,"??????????????????????????????????????????
??????????????????? 10 ????????? ???? ""0880880880""",8/25/2020,2020,8,25,3.5,Outside
2.27266E+15,??? ???,8/26/2020 8:05,User,?????????????????????????,8/26/2020,2020,8,26,3.5,
2.27266E+15,??? ???,8/26/2020 8:05,Admin,"?????????????? ?????????????????????????????????????????? ??
????????????????????????",8/26/2020,2020,8,26,3.5,Outside
2.27497E+15,Aom Faksuwan,9/1/2020 18:31,User,??????4???7?????????????,9/1/2020,2020,9,1,3.5,
2.27497E+15,Aom Faksuwan,9/1/2020 18:31,Admin,"??????????????????????????????????????????
??????????????????? 10 ????????? ???? ""0880880880""",9/1/2020,2020,9,1,3.5,Outside
2.27535E+15,Milk Arisara,9/5/2020 20:41,Admin,?? ??,9/5/2020,2020,9,5,1.5,
2.27535E+15,Milk Arisara,9/5/2020 20:41,Admin,??????????????????? ?????????????????????????????,9/5/2020,2020,9,5,1.5,Outside
2.27535E+15,Milk Arisara,9/5/2020 20:41,Admin,??????????????????? ?????????????????????????????,9/5/2020,2020,9,5,1.5,Outside
2.27535E+15,Milk Arisara,9/5/2020 20:41,Admin,??????????????????? ?????????????????????????????,9/5/2020,2020,9,5,1.5,Outside
2.27605E+15,Supa Sripiem,8/8/2020 22:17,Admin,?????? ?????????????,8/8/2020,2020,8,8,6.5,
2.27605E+15,Supa Sripiem,8/8/2020 22:17,Admin,?????????????????????????????????????,8/8/2020,2020,8,8,6.5,Outside
2.2761E+15,????????? ???????????,8/29/2020 14:10,Admin,"?? ""??????"" ?????",8/29/2020,2020,8,29,4.5,
2.2761E+15,????????? ???????????,8/29/2020 14:10,Admin,"????????????????????????
??????? ?????????? ??????
?????????????? 0617101081",8/29/2020,2020,8,29,4.5,Outside
2.27935E+15,????' ?????',9/6/2020 21:19,User,GPX,9/6/2020,2020,9,6,5.5,
2.27935E+15,????' ?????',9/6/2020 21:19,Admin,????????????????????????????????????,9/6/2020,2020,9,6,5.5,Outside
2.28106E+15,??? ??,9/3/2020 18:01,Admin,?? ??,9/3/2020,2020,9,3,1.5,
2.28106E+15,??? ??,9/3/2020 18:01,Admin,??????????????????? ?????????????????????????????,9/3/2020,2020,9,3,1.5,Outside
2.28106E+15,??? ??,9/3/2020 18:06,User,"????????????????????????? ???????????????????????????? ???????23,000??????????? 15,000 ????????????????????????????????????8,000",9/3/2020,2020,9,3,3.5,
2.28106E+15,??? ??,9/3/2020 18:07,Admin,"??????????????????????????????????????????
??????????????????? 10 ?????????? ???? ""0880880880""",9/3/2020,2020,9,3,3.5,Outside
2.28912E+15,???? ?????,8/26/2020 7:54,User,???????????????,8/26/2020,2020,8,26,3.5,
2.28912E+15,???? ?????,8/26/2020 7:54,Admin,"??????????????????????????????????????????
??????????????????? 10 ????????? ???? ""0880880880""",8/26/2020,2020,8,26,3.5,Outside
2.28912E+15,???? ?????,8/26/2020 7:55,Admin,"?? ""??????"" ????????????????????????? ???????????????? ?????????????????????????",8/26/2020,2020,8,26,3.5,
2.28912E+15,???? ?????,8/26/2020 7:55,Admin,"?????????????? ?????????????????????????????????????????? ??
????????????????????????",8/26/2020,2020,8,26,3.5,Outside
2.29745E+15,Pla Samerphithak,9/4/2020 20:47,User,????????????????????????????,9/4/2020,2020,9,4,3.5,
2.29745E+15,Pla Samerphithak,9/4/2020 20:47,Admin,"??????????????????????????????????????????
??????????????????? 10 ?????????? ???? ""0880880880""",9/4/2020,2020,9,4,3.5,Outside
2.29901E+15,????? ?????????,8/31/2020 11:27,User,?????? ?????????,8/31/2020,2020,8,31,2.5,
2.29901E+15,????? ?????????,8/31/2020 11:27,Admin,??????? - ??????? ????????,8/31/2020,2020,8,31,2.5,Outside
2.30458E+15,Flame Buarapa,8/10/2020 16:06,User,??????,8/10/2020,2020,8,10,5.5,
2.30458E+15,Flame Buarapa,8/10/2020 16:06,Admin,???????????????????????????????????????,8/10/2020,2020,8,10,5.5,Outside
2.30751E+15,Noopug Supawinee,8/9/2020 13:56,User,?????????????????,8/9/2020,2020,8,9,3.5,
2.30751E+15,Noopug Supawinee,8/9/2020 13:56,Admin,"??????????????????????????????????????????
??????????????????? 10 ????????? ???? ""0880880880""",8/9/2020,2020,8,9,3.5,Outside
2.30751E+15,Noopug Supawinee,8/9/2020 14:05,User,???????????????????????????,8/9/2020,2020,8,9,11.5,
2.30751E+15,Noopug Supawinee,8/9/2020 14:05,Admin,"??????????????????? ???????????????????? ???????????????????????? ??
(???????????? ????????)",8/9/2020,2020,8,9,11.5,Outside
2.30782E+15,Anulack Ratchada,9/7/2020 10:30,User,0985439448 ???????????? ?????????????????????,9/7/2020,2020,9,7,3.5,
2.30782E+15,Anulack Ratchada,9/7/2020 10:30,Admin,"??????????????????????????????????????????
??????????????????? 10 ?????????? ???? ""0880880880""",9/7/2020,2020,9,7,3.5,Outside
2.30807E+15,???' ???,8/14/2020 10:48,User,??????????????????????,8/14/2020,2020,8,14,11.5,
2.30807E+15,???' ???,8/14/2020 10:48,Admin,"???????????????? ???????????????????? ???????????????????????? ??
(???????????? ?????)",8/14/2020,2020,8,14,11.5,Outside
2.30955E+15,???????????????? ???,8/28/2020 12:44,User,????????????????    ??????????????  ???????2016,8/28/2020,2020,8,28,1.5,
2.30955E+15,???????????????? ???,8/28/2020 12:44,Admin,??????????????????? ?????????????????????????????,8/28/2020,2020,8,28,1.5,Outside
2.30955E+15,???????????????? ???,8/28/2020 12:45,User,????????? 2016   ???????  ????????????????,8/28/2020,2020,8,28,3.5,
2.30955E+15,???????????????? ???,8/28/2020 12:45,Admin,"??????????????????????????????????????????
??????????????????? 10 ?????????? ???? ""0880880880""",8/28/2020,2020,8,28,3.5,Outside
2.30955E+15,???????????????? ???,8/28/2020 12:52,User,??????????,8/28/2020,2020,8,28,3.5,
2.30955E+15,???????????????? ???,8/28/2020 12:52,Admin,"?????????????? ?????????????????????????????????????????? ??
?????????????????????????",8/28/2020,2020,8,28,3.5,Outside
2.3097E+15,Suthanya Ple,9/5/2020 9:14,User,?????????? ??????????????????????.??????????????????????,9/5/2020,2020,9,5,3.5,
2.3097E+15,Suthanya Ple,9/5/2020 9:14,Admin,"??????????????????????????????????????????
??????????????????? 10 ?????????? ???? ""0880880880""",9/5/2020,2020,9,5,3.5,Outside
2.31177E+15,Kaikai Kaikai,9/5/2020 11:55,Admin,BTN_Creditcar2,9/5/2020,2020,9,5,1.5,
2.31177E+15,Kaikai Kaikai,9/5/2020 11:55,Admin,??????????????????? ?????????????????????????????,9/5/2020,2020,9,5,1.5,Outside
2.31389E+15,????? ???????,9/5/2020 17:37,Admin,????????????????? (????????????????) ???????????????????????????? 0.55%-2.05% ???????? (??????????????????????????????????? 11.97%-42.69% ?????),9/5/2020,2020,9,5,3.5,
2.31389E+15,????? ???????,9/5/2020 17:37,Admin,"??????????????????????????????????????????
??????????????????? 10 ?????????? ???? ""0880880880""",9/5/2020,2020,9,5,3.5,Outside
2.31389E+15,????? ???????,9/6/2020 13:52,Admin,????????? ??????????????????? ???????????? ?????????????????????,9/6/2020,2020,9,6,1.5,
2.31389E+15,????? ???????,9/6/2020 13:52,Admin,??????????????????? ?????????????????????????????,9/6/2020,2020,9,6,1.5,Outside
2.31389E+15,????? ???????,9/6/2020 13:53,User,???????????,9/6/2020,2020,9,6,2.5,
2.31389E+15,????? ???????,9/6/2020 13:53,Admin,??????? - ??????? ????????,9/6/2020,2020,9,6,2.5,Outside
2.31389E+15,????? ???????,9/6/2020 13:54,User,????? ???????,9/6/2020,2020,9,6,3.5,
2.31389E+15,????? ???????,9/6/2020 13:54,Admin,"????????????????????? ???????????????????
( ?????????????? 10 ???? ???? 0880880880 )",9/6/2020,2020,9,6,3.5,Outside
2.31389E+15,????? ???????,9/6/2020 13:54,User,982258499,9/6/2020,2020,9,6,4.5,
2.31389E+15,????? ???????,9/6/2020 13:54,Admin,"????????????????????????
??????? ????? ???????
?????????????? 0982258499",9/6/2020,2020,9,6,4.5,Outside
2.31389E+15,????? ???????,9/6/2020 13:54,Admin,?????????????????????????????????????,9/6/2020,2020,9,6,5.5,
2.31389E+15,????? ???????,9/6/2020 13:54,Admin,????????????????????????????????????,9/6/2020,2020,9,6,5.5,Outside
2.31389E+15,????? ???????,9/6/2020 13:54,Admin,?????? ????????????,9/6/2020,2020,9,6,6.5,
2.31389E+15,????? ???????,9/6/2020 13:54,Admin,??????????????????????????????????,9/6/2020,2020,9,6,6.5,Outside
2.31389E+15,????? ???????,9/6/2020 13:54,User,2020,9/6/2020,2020,9,6,8.5,
2.31389E+15,????? ???????,9/6/2020 13:54,Admin,"??????????????????????????
?????? ??????
?????? ??????????
?? 2020",9/6/2020,2020,9,6,8.5,Outside
2.31389E+15,????? ???????,9/6/2020 13:55,Admin,?????????????????????????????? ??? ?????????????????????????????????? ????????????????????????????? ??????????????????????????? ???????????????????????? ?????????????????????????????? ?????????????????????????????????????????????????? ????? ??????????????????????????????????????????????????????????? ????????????????????????????????????????????????????????????????????????????????????????????????????????????????,9/6/2020,2020,9,6,9.5,
2.31389E+15,????? ???????,9/6/2020 13:55,Admin,??????????????????????????????,9/6/2020,2020,9,6,9.5,Outside
2.31654E+15,Pond Rewat,8/5/2020 1:35,User,???????????????????????????????????????????????????????????????????????????,8/5/2020,2020,8,5,3.5,
2.31654E+15,Pond Rewat,8/5/2020 1:35,Admin,"??????????????????????????????????????????
??????????????????? 10 ????????? ???? ""0880880880""",8/5/2020,2020,8,5,3.5,Outside
2.32075E+15,???? ??????,8/17/2020 17:29,Admin,?????? ?????????????,8/17/2020,2020,8,17,6.5,
2.32075E+15,???? ??????,8/17/2020 17:29,Admin,?????????????????????????????????????,8/17/2020,2020,8,17,6.5,Outside
2.32075E+15,???? ??????,8/17/2020 17:30,Admin,?????? ?????????????,8/17/2020,2020,8,17,6.5,
2.32075E+15,???? ??????,8/17/2020 17:30,Admin,?????????????????????????????????????,8/17/2020,2020,8,17,6.5,Outside
2.32075E+15,???? ??????,8/17/2020 17:30,User,forza,8/17/2020,2020,8,17,6.5,
2.32075E+15,???? ??????,8/17/2020 17:30,Admin,?????????????????????????????????????,8/17/2020,2020,8,17,6.5,Outside
2.32386E+15,????????? ?????????,9/2/2020 11:14,Admin,?? ??,9/2/2020,2020,9,2,3.5,
2.32386E+15,????????? ?????????,9/2/2020 11:14,Admin,"??????????????????????????????????????????
??????????????????? 10 ?????????? ???? ""0880880880""",9/2/2020,2020,9,2,3.5,Outside
2.32386E+15,????????? ?????????,9/2/2020 11:14,Admin,"??????????????????????????????????????????
??????????????????? 10 ?????????? ???? ""0880880880""",9/2/2020,2020,9,2,3.5,Outside
2.32386E+15,????????? ?????????,9/2/2020 11:14,Admin,??????????????????? ?????????????????????????????,9/2/2020,2020,9,2,1.5,Outside
2.32439E+15,???? ????????,8/30/2020 20:38,User,????...????????,8/30/2020,2020,8,30,2.5,
2.32439E+15,???? ????????,8/30/2020 20:38,Admin,??????? - ??????? ????????,8/30/2020,2020,8,30,2.5,Outside
2.32666E+15,Sukanya Kanarot,8/26/2020 8:19,Admin,?????? ?????????????,8/26/2020,2020,8,26,6.5,
2.32666E+15,Sukanya Kanarot,8/26/2020 8:19,Admin,?????????????????????????????????????,8/26/2020,2020,8,26,6.5,Outside
2.32666E+15,Sukanya Kanarot,8/26/2020 8:20,Admin,?????? ?????????????,8/26/2020,2020,8,26,6.5,
2.32666E+15,Sukanya Kanarot,8/26/2020 8:20,Admin,?????????????????????????????????????,8/26/2020,2020,8,26,6.5,Outside
2.32798E+15,?? ??????,8/27/2020 14:35,Admin,???????????????????? ??????????????????????????????,8/27/2020,2020,8,27,5.5,
2.32798E+15,?? ??????,8/27/2020 14:35,Admin,???????????????????????????????????????,8/27/2020,2020,8,27,5.5,Outside
2.32798E+15,?? ??????,8/27/2020 14:36,Admin,?????? ?????????????,8/27/2020,2020,8,27,6.5,
2.32798E+15,?? ??????,8/27/2020 14:36,Admin,?????????????????????????????????????,8/27/2020,2020,8,27,6.5,Outside
2.32798E+15,?? ??????,8/27/2020 14:45,Admin,?????? ?????????????,8/27/2020,2020,8,27,6.5,
2.32798E+15,?? ??????,8/27/2020 14:45,Admin,?????????????????????????????????????,8/27/2020,2020,8,27,6.5,Outside
2.32798E+15,?? ??????,8/27/2020 14:45,User,???????,8/27/2020,2020,8,27,6.5,
2.32798E+15,?? ??????,8/27/2020 14:45,Admin,?????????????????????????????????????,8/27/2020,2020,8,27,6.5,Outside
2.32798E+15,?? ??????,8/27/2020 15:21,Admin,????????????????????????????????????,8/27/2020,2020,8,27,5.5,
2.32798E+15,?? ??????,8/27/2020 15:21,Admin,???????????????????????????????????????,8/27/2020,2020,8,27,5.5,Outside
2.32798E+15,?? ??????,8/27/2020 15:21,Admin,?????? ?????????????,8/27/2020,2020,8,27,6.5,
2.32798E+15,?? ??????,8/27/2020 15:21,Admin,?????????????????????????????????????,8/27/2020,2020,8,27,6.5,Outside
2.32955E+15,Pattaraporn Aeamkrajang,8/30/2020 21:43,Admin,?????????????????? ???????????????????????????????????? ???????????????????????? ?????????????????????,8/30/2020,2020,8,30,3.5,
2.32955E+15,Pattaraporn Aeamkrajang,8/30/2020 21:43,Admin,"??????????????????????????????????????????
??????????????????? 10 ?????????? ???? ""0880880880""",8/30/2020,2020,8,30,3.5,Outside
2.32955E+15,Pattaraporn Aeamkrajang,8/30/2020 21:44,Admin,?? ??,8/30/2020,2020,8,30,3.5,
2.32955E+15,Pattaraporn Aeamkrajang,8/30/2020 21:44,Admin,"?????????????? ?????????????????????????????????????????? ??
?????????????????????????",8/30/2020,2020,8,30,3.5,Outside
2.32955E+15,Pattaraporn Aeamkrajang,8/30/2020 21:44,Admin,"?????????????? ?????????????????????????????????????????? ??
?????????????????????????",8/30/2020,2020,8,30,3.5,Outside
2.32955E+15,Pattaraporn Aeamkrajang,8/30/2020 21:44,Admin,??????????????????? ?????????????????????????????,8/30/2020,2020,8,30,1.5,Outside
2.33772E+15,Wipa Saad,8/30/2020 9:51,Admin,???????????????????? ??????????????????????????????,8/30/2020,2020,8,30,1.5,
2.33772E+15,Wipa Saad,8/30/2020 9:51,Admin,??????????????????? ?????????????????????????????,8/30/2020,2020,8,30,1.5,Outside
2.34465E+15,Noina Saiphin,9/2/2020 7:10,User,????????????????????????,9/2/2020,2020,9,2,1.5,
2.34465E+15,Noina Saiphin,9/2/2020 7:10,Admin,??????????????????? ?????????????????????????????,9/2/2020,2020,9,2,1.5,Outside
2.34516E+15,Budsarin Boriboon,8/10/2020 16:10,Admin,????????????????????????????????,8/10/2020,2020,8,10,6.5,
2.34516E+15,Budsarin Boriboon,8/10/2020 16:10,Admin,?????????????????????????????????????,8/10/2020,2020,8,10,6.5,Outside
2.34809E+15,Nut't Nut,8/9/2020 10:54,Admin,?????? ?????????????,8/9/2020,2020,8,9,6.5,
2.34809E+15,Nut't Nut,8/9/2020 10:54,Admin,?????????????????????????????????????,8/9/2020,2020,8,9,6.5,Outside
2.34809E+15,Nut't Nut,8/9/2020 11:36,User,???????????????,8/9/2020,2020,8,9,11.5,
2.34809E+15,Nut't Nut,8/9/2020 11:36,Admin,"???????????????? ???????????????????? ???????????????????????? ??
(???????????? ?????)",8/9/2020,2020,8,9,11.5,Outside
2.34828E+15,kit Nback,8/11/2020 15:23,Admin,????????????????????????,8/11/2020,2020,8,11,3.5,
2.34828E+15,kit Nback,8/11/2020 15:23,Admin,"??????????????????????????????????????????
??????????????????? 10 ????????? ???? ""0880880880""",8/11/2020,2020,8,11,3.5,Outside
2.35026E+15,Bee Eiei,8/29/2020 12:30,Admin,?? ??,8/29/2020,2020,8,29,3.5,
2.35026E+15,Bee Eiei,8/29/2020 12:30,Admin,"??????????????????????????????????????????
??????????????????? 10 ?????????? ???? ""0880880880""",8/29/2020,2020,8,29,3.5,Outside
2.35026E+15,Bee Eiei,8/29/2020 12:30,Admin,"??????????????????????????????????????????
??????????????????? 10 ?????????? ???? ""0880880880""",8/29/2020,2020,8,29,3.5,Outside
2.35026E+15,Bee Eiei,8/29/2020 12:30,Admin,??????????????????? ?????????????????????????????,8/29/2020,2020,8,29,1.5,Outside
2.35026E+15,Bee Eiei,8/29/2020 12:31,Admin,?? ??,8/29/2020,2020,8,29,1.5,
2.35026E+15,Bee Eiei,8/29/2020 12:31,Admin,??????????????????? ?????????????????????????????,8/29/2020,2020,8,29,1.5,Outside
2.35026E+15,Bee Eiei,8/29/2020 12:31,Admin,??????????????????? ?????????????????????????????,8/29/2020,2020,8,29,1.5,Outside
2.35026E+15,Bee Eiei,8/29/2020 12:31,Admin,??????????????????? ?????????????????????????????,8/29/2020,2020,8,29,1.5,Outside
2.35026E+15,Bee Eiei,8/29/2020 12:31,User,???????????,8/29/2020,2020,8,29,2.5,
2.35026E+15,Bee Eiei,8/29/2020 12:31,Admin,??????? - ??????? ????????,8/29/2020,2020,8,29,2.5,Outside
2.35026E+15,Bee Eiei,8/29/2020 12:31,User,??????? ??????,8/29/2020,2020,8,29,3.5,
2.35026E+15,Bee Eiei,8/29/2020 12:31,Admin,"????????????????????? ???????????????????
( ?????????????? 10 ???? ???? 0880880880 )",8/29/2020,2020,8,29,3.5,Outside
2.35059E+15,?????? ????????,8/21/2020 14:02,Admin,?????? ?????????????,8/21/2020,2020,8,21,6.5,
2.35059E+15,?????? ????????,8/21/2020 14:02,Admin,?????????????????????????????????????,8/21/2020,2020,8,21,6.5,Outside
2.35059E+15,?????? ????????,8/21/2020 14:02,Admin,?????? ?????????????,8/21/2020,2020,8,21,6.5,
2.35059E+15,?????? ????????,8/21/2020 14:02,Admin,?????????????????????????????????????,8/21/2020,2020,8,21,6.5,Outside
2.35059E+15,?????? ????????,8/21/2020 14:03,Admin,CRS_Motorcycleloan2,8/21/2020,2020,8,21,6.5,
2.35059E+15,?????? ????????,8/21/2020 14:03,Admin,?????????????????????????????????????,8/21/2020,2020,8,21,6.5,Outside
2.35523E+15,??? ??????,8/17/2020 16:35,Admin,????????????????????????????????????,8/17/2020,2020,8,17,5.5,
2.35523E+15,??? ??????,8/17/2020 16:35,Admin,???????????????????????????????????????,8/17/2020,2020,8,17,5.5,Outside
2.35523E+15,??? ??????,8/17/2020 16:35,Admin,?????? ?????????????,8/17/2020,2020,8,17,6.5,
2.35523E+15,??? ??????,8/17/2020 16:35,Admin,?????????????????????????????????????,8/17/2020,2020,8,17,6.5,Outside
2.35743E+15,???'???? ???????'?,8/30/2020 17:07,Admin,BTN_Creditcar2,8/30/2020,2020,8,30,1.5,
2.35743E+15,???'???? ???????'?,8/30/2020 17:07,Admin,??????????????????? ?????????????????????????????,8/30/2020,2020,8,30,1.5,Outside
2.35743E+15,???'???? ???????'?,8/30/2020 17:07,Admin,BTN_Creditcar2,8/30/2020,2020,8,30,1.5,
2.35743E+15,???'???? ???????'?,8/30/2020 17:07,Admin,??????????????????? ?????????????????????????????,8/30/2020,2020,8,30,1.5,Outside
2.35818E+15,??????? ?????????,9/5/2020 12:18,Admin,?? ??,9/5/2020,2020,9,5,1.5,
2.35818E+15,??????? ?????????,9/5/2020 12:18,Admin,??????????????????? ?????????????????????????????,9/5/2020,2020,9,5,1.5,Outside
2.36342E+15,Niphaporn Thonphon Tik,9/1/2020 9:02,User,???,9/1/2020,2020,9,1,4.5,
2.36342E+15,Niphaporn Thonphon Tik,9/1/2020 9:02,Admin,"????????????????????????
??????? ?????? ????
?????????????? 0625718277",9/1/2020,2020,9,1,4.5,Outside
2.36342E+15,Niphaporn Thonphon Tik,9/1/2020 9:04,User,?????????????,9/1/2020,2020,9,1,7.5,
2.36342E+15,Niphaporn Thonphon Tik,9/1/2020 9:04,Admin,??????????????????????????????????????? ???? 2018,9/1/2020,2020,9,1,7.5,Outside
2.36457E+15,?????????' '??????????',9/3/2020 16:00,Admin,?? ??,9/3/2020,2020,9,3,1.5,
2.36457E+15,?????????' '??????????',9/3/2020 16:00,Admin,??????????????????? ?????????????????????????????,9/3/2020,2020,9,3,1.5,Outside
2.36457E+15,?????????' '??????????',9/3/2020 16:00,User,???????????,9/3/2020,2020,9,3,2.5,
2.36457E+15,?????????' '??????????',9/3/2020 16:00,Admin,??????? - ??????? ????????,9/3/2020,2020,9,3,2.5,Outside
2.36457E+15,?????????' '??????????',9/3/2020 16:21,User,???????,9/3/2020,2020,9,3,7.5,
2.36457E+15,?????????' '??????????',9/3/2020 16:21,Admin,??????????????????????????????????????? ???? 2018,9/3/2020,2020,9,3,7.5,Outside
2.36962E+15,Duangruethai Jansamut,8/26/2020 6:57,Admin,?????? ???????????,8/26/2020,2020,8,26,6.5,
2.36962E+15,Duangruethai Jansamut,8/26/2020 6:57,Admin,?????????????????????????????????????,8/26/2020,2020,8,26,6.5,Outside
2.36962E+15,Duangruethai Jansamut,8/26/2020 12:20,Admin,????????????????????????????????????,8/26/2020,2020,8,26,5.5,
2.36962E+15,Duangruethai Jansamut,8/26/2020 12:20,Admin,???????????????????????????????????????,8/26/2020,2020,8,26,5.5,Outside
2.36962E+15,Duangruethai Jansamut,8/26/2020 12:21,Admin,?????? ?????????????,8/26/2020,2020,8,26,6.5,
2.36962E+15,Duangruethai Jansamut,8/26/2020 12:21,Admin,?????????????????????????????????????,8/26/2020,2020,8,26,6.5,Outside
2.36962E+15,Duangruethai Jansamut,8/26/2020 12:23,Admin,?? ??,8/26/2020,2020,8,26,10.5,
2.36962E+15,Duangruethai Jansamut,8/26/2020 12:23,Admin,??????????? ????????????????????????????????,8/26/2020,2020,8,26,10.5,Outside
2.37474E+15,???? ??????,8/31/2020 17:39,User,???????????????????15000,8/31/2020,2020,8,31,1.5,
2.37474E+15,???? ??????,8/31/2020 17:39,Admin,??????????????????? ?????????????????????????????,8/31/2020,2020,8,31,1.5,Outside
2.37629E+15,Anucha Intupooti,8/5/2020 19:38,User,?????????,8/5/2020,2020,8,5,12.5,
2.37629E+15,Anucha Intupooti,8/5/2020 19:38,Admin,"?????????????????? ???????????????????? ???????????????????????? ??
(???????????? ????????)",8/5/2020,2020,8,5,12.5,Outside
2.37695E+15,Anongnad Hnoothong,9/4/2020 15:39,Admin,???????????????????????????????????????? ??????????????????????????????????,9/4/2020,2020,9,4,9.5,
2.37695E+15,Anongnad Hnoothong,9/4/2020 15:39,Admin,??????????????????????????????,9/4/2020,2020,9,4,9.5,Outside
2.37695E+15,Anongnad Hnoothong,9/4/2020 15:40,User,??????,9/4/2020,2020,9,4,11.5,
2.37695E+15,Anongnad Hnoothong,9/4/2020 15:40,Admin,"??????????????????? ???????????????????? ???????????????????????? ??
(???????????? ????????)",9/4/2020,2020,9,4,11.5,Outside
2.3774E+15,???? ????????,8/27/2020 22:43,Admin,CRS_Carinsurance2,8/27/2020,2020,8,27,1.5,
2.3774E+15,???? ????????,8/27/2020 22:43,Admin,??????????????????? ?????????????????????????????,8/27/2020,2020,8,27,1.5,Outside
2.37948E+15,Warunee Jitsupa,9/6/2020 10:30,Admin,CRS_Carinsurance2,9/6/2020,2020,9,6,1.5,
2.37948E+15,Warunee Jitsupa,9/6/2020 10:30,Admin,??????????????????? ?????????????????????????????,9/6/2020,2020,9,6,1.5,Outside
2.38027E+15,???? ??? ???,8/19/2020 11:48,User,??????,8/19/2020,2020,8,19,3.5,
2.38027E+15,???? ??? ???,8/19/2020 11:48,Admin,"??????????????????????????????????????????
??????????????????? 10 ????????? ???? ""0880880880""",8/19/2020,2020,8,19,3.5,Outside
2.38027E+15,???? ??? ???,8/19/2020 11:49,User,Kugkik16,8/19/2020,2020,8,19,3.5,
2.38027E+15,???? ??? ???,8/19/2020 11:49,Admin,"?????????????? ?????????????????????????????????????????? ??
????????????????????????",8/19/2020,2020,8,19,3.5,Outside
2.3823E+15,?????? ???????,8/30/2020 23:41,Admin,BTN_Creditcar2,8/30/2020,2020,8,30,1.5,
2.3823E+15,?????? ???????,8/30/2020 23:41,Admin,??????????????????? ?????????????????????????????,8/30/2020,2020,8,30,1.5,Outside
2.3823E+15,?????? ???????,8/30/2020 23:44,User,?????????????????????????????    ????????????   ????????????????????3??????  ???????????????    ??????????????????,8/30/2020,2020,8,30,2.5,
2.3823E+15,?????? ???????,8/30/2020 23:44,Admin,??????? - ??????? ????????,8/30/2020,2020,8,30,2.5,Outside
2.38809E+15,Nut Chakkrit,8/7/2020 14:14,User,? ?????,8/7/2020,2020,8,7,11.5,
2.38809E+15,Nut Chakkrit,8/7/2020 14:14,Admin,"??????????????????? ???????????????????? ???????????????????????? ??
(???????????? ????????)",8/7/2020,2020,8,7,11.5,Outside
2.38867E+15,??????? ??????,8/26/2020 13:30,Admin,?????? ?????????????,8/26/2020,2020,8,26,6.5,
2.38867E+15,??????? ??????,8/26/2020 13:30,Admin,?????????????????????????????????????,8/26/2020,2020,8,26,6.5,Outside
2.39262E+15,?????????????? ????????????????????,8/31/2020 9:46,User,?????125 ???????????????,8/31/2020,2020,8,31,3.5,
2.39262E+15,?????????????? ????????????????????,8/31/2020 9:46,Admin,"??????????????????????????????????????????
??????????????????? 10 ?????????? ???? ""0880880880""",8/31/2020,2020,8,31,3.5,Outside
2.39509E+15,??? ?????? ???????,9/6/2020 23:50,Admin,?? ??,9/6/2020,2020,9,6,2.5,
2.39509E+15,??? ?????? ???????,9/6/2020 23:50,Admin,??????? - ??????? ????????,9/6/2020,2020,9,6,2.5,Outside
2.39509E+15,??? ?????? ???????,9/6/2020 23:50,Admin,??????? - ??????? ????????,9/6/2020,2020,9,6,2.5,Outside
2.39509E+15,??? ?????? ???????,9/6/2020 23:50,Admin,??????????????????? ?????????????????????????????,9/6/2020,2020,9,6,1.5,Outside
2.39509E+15,??? ?????? ???????,9/6/2020 23:51,User,?????? ???????,9/6/2020,2020,9,6,1.5,
2.39509E+15,??? ?????? ???????,9/6/2020 23:51,Admin,??????????????????? ?????????????????????????????,9/6/2020,2020,9,6,1.5,Outside
2.39509E+15,??? ?????? ???????,9/6/2020 23:51,User,???????????,9/6/2020,2020,9,6,2.5,
2.39509E+15,??? ?????? ???????,9/6/2020 23:51,Admin,??????? - ??????? ????????,9/6/2020,2020,9,6,2.5,Outside
2.39577E+15,???? ????????,8/8/2020 19:32,User,0640796694?,8/8/2020,2020,8,8,3.5,
2.39577E+15,???? ????????,8/8/2020 19:32,Admin,"??????????????????????????????????????????
??????????????????? 10 ????????? ???? ""0880880880""",8/8/2020,2020,8,8,3.5,Outside
2.3966E+15,??????????? ????????????,8/16/2020 19:22,User,???????????,8/16/2020,2020,8,16,3.5,
2.3966E+15,??????????? ????????????,8/16/2020 19:22,Admin,"??????????????????????????????????????????
??????????????????? 10 ????????? ???? ""0880880880""",8/16/2020,2020,8,16,3.5,Outside
2.39671E+15,?????? ???????,8/6/2020 23:57,Admin,????????????????????????????????????????????????????????,8/6/2020,2020,8,6,3.5,
2.39671E+15,?????? ???????,8/6/2020 23:57,Admin,"??????????????????????????????????????????
??????????????????? 10 ????????? ???? ""0880880880""",8/6/2020,2020,8,6,3.5,Outside
2.39985E+15,Janpen Wareesri,9/5/2020 6:39,User,2007,9/5/2020,2020,9,5,8.5,
2.39985E+15,Janpen Wareesri,9/5/2020 6:39,Admin,"??????????????????????????
?????? ??????
?????? ????
?? 2006",9/5/2020,2020,9,5,8.5,Outside
2.40617E+15,Newyear Tuynuy,9/6/2020 14:16,Admin,?? ??,9/6/2020,2020,9,6,1.5,
2.40617E+15,Newyear Tuynuy,9/6/2020 14:16,Admin,??????????????????? ?????????????????????????????,9/6/2020,2020,9,6,1.5,Outside
2.40617E+15,Newyear Tuynuy,9/6/2020 14:16,Admin,??????????????????? ?????????????????????????????,9/6/2020,2020,9,6,1.5,Outside
2.40617E+15,Newyear Tuynuy,9/6/2020 14:16,Admin,??????????????????? ?????????????????????????????,9/6/2020,2020,9,6,1.5,Outside
2.40617E+15,Newyear Tuynuy,9/6/2020 14:17,Admin,?? ??,9/6/2020,2020,9,6,1.5,
2.40617E+15,Newyear Tuynuy,9/6/2020 14:17,Admin,??????????????????? ?????????????????????????????,9/6/2020,2020,9,6,1.5,Outside
2.40617E+15,Newyear Tuynuy,9/6/2020 14:18,User,????????????????????????????,9/6/2020,2020,9,6,3.5,
2.40617E+15,Newyear Tuynuy,9/6/2020 14:19,Admin,"??????????????????????????????????????????
??????????????????? 10 ?????????? ???? ""0880880880""",9/6/2020,2020,9,6,3.5,Outside
2.40617E+15,Newyear Tuynuy,9/6/2020 14:20,User,????????,9/6/2020,2020,9,6,7.5,
2.40617E+15,Newyear Tuynuy,9/6/2020 14:20,Admin,??????????????????????????????????????? ???? 2018,9/6/2020,2020,9,6,7.5,Outside
2.40617E+15,Newyear Tuynuy,9/6/2020 22:00,Admin,?? ??,9/6/2020,2020,9,6,1.5,
2.40617E+15,Newyear Tuynuy,9/6/2020 22:00,Admin,??????????????????? ?????????????????????????????,9/6/2020,2020,9,6,1.5,Outside
2.40617E+15,Newyear Tuynuy,9/6/2020 22:00,User,???????????,9/6/2020,2020,9,6,2.5,
2.40617E+15,Newyear Tuynuy,9/6/2020 22:00,Admin,??????? - ??????? ????????,9/6/2020,2020,9,6,2.5,Outside
2.40617E+15,Newyear Tuynuy,9/6/2020 22:00,User,???? ?????????,9/6/2020,2020,9,6,3.5,
2.40617E+15,Newyear Tuynuy,9/6/2020 22:00,Admin,"????????????????????? ???????????????????
( ?????????????? 10 ???? ???? 0880880880 )",9/6/2020,2020,9,6,3.5,Outside
2.40617E+15,Newyear Tuynuy,9/6/2020 22:01,User,985650764,9/6/2020,2020,9,6,4.5,
2.40617E+15,Newyear Tuynuy,9/6/2020 22:01,Admin,"????????????????????????
??????? ???? ?????????
?????????????? 0985650764",9/6/2020,2020,9,6,4.5,Outside
2.40617E+15,Newyear Tuynuy,9/6/2020 22:01,Admin,?????????????????????????????????????,9/6/2020,2020,9,6,5.5,
2.40617E+15,Newyear Tuynuy,9/6/2020 22:01,Admin,????????????????????????????????????,9/6/2020,2020,9,6,5.5,Outside
2.40617E+15,Newyear Tuynuy,9/6/2020 22:01,Admin,?????? ????????????,9/6/2020,2020,9,6,6.5,
2.40617E+15,Newyear Tuynuy,9/6/2020 22:01,Admin,??????????????????????????????????,9/6/2020,2020,9,6,6.5,Outside
2.40617E+15,Newyear Tuynuy,9/6/2020 22:01,Admin,?????? ????????????,9/6/2020,2020,9,6,6.5,
2.40617E+15,Newyear Tuynuy,9/6/2020 22:01,Admin,??????????????????????????????????,9/6/2020,2020,9,6,6.5,Outside
2.40759E+15,Danidream Innok,8/15/2020 3:28,User,???????????,8/15/2020,2020,8,15,3.5,
2.40759E+15,Danidream Innok,8/15/2020 3:28,Admin,"??????????????????????????????????????????
??????????????????? 10 ????????? ???? ""0880880880""",8/15/2020,2020,8,15,3.5,Outside
2.40759E+15,Danidream Innok,8/15/2020 3:29,User,?????????????????????????????,8/15/2020,2020,8,15,3.5,
2.40759E+15,Danidream Innok,8/15/2020 3:29,Admin,"?????????????? ?????????????????????????????????????????? ??
????????????????????????",8/15/2020,2020,8,15,3.5,Outside
2.40916E+15,????? ???????,9/5/2020 22:50,User,?????.. ???????,9/5/2020,2020,9,5,2.5,
2.40916E+15,????? ???????,9/5/2020 22:50,Admin,??????? - ??????? ????????,9/5/2020,2020,9,5,2.5,Outside
2.41066E+15,??? '???,9/3/2020 22:29,User,???????????????????????????????????,9/3/2020,2020,9,3,3.5,
2.41066E+15,??? '???,9/3/2020 22:29,Admin,"??????????????????????????????????????????
??????????????????? 10 ?????????? ???? ""0880880880""",9/3/2020,2020,9,3,3.5,Outside
2.41079E+15,Porntiwa Chaiypoom,9/3/2020 0:36,User,??50,9/3/2020,2020,9,3,7.5,
2.41079E+15,Porntiwa Chaiypoom,9/3/2020 0:37,Admin,??????????????????????????????????????? ???? 2018,9/3/2020,2020,9,3,7.5,Outside
2.41117E+15,Jirayuth Ranuga,9/4/2020 12:57,User,???????? ????????,9/4/2020,2020,9,4,4.5,
2.41117E+15,Jirayuth Ranuga,9/4/2020 12:57,Admin,"????????????????????????
??????? ??????????
?????????????? 0950745560",9/4/2020,2020,9,4,4.5,Outside
2.41368E+15,Chaninya Sansupha,8/24/2020 17:55,User,???????????????????????,8/24/2020,2020,8,24,3.5,
2.41368E+15,Chaninya Sansupha,8/24/2020 17:55,Admin,"??????????????????????????????????????????
??????????????????? 10 ????????? ???? ""0880880880""",8/24/2020,2020,8,24,3.5,Outside
2.41789E+15,Naja Treerat,8/27/2020 10:18,User,??????????????,8/27/2020,2020,8,27,5.5,
2.41789E+15,Naja Treerat,8/27/2020 10:18,Admin,???????????????????????????????????????,8/27/2020,2020,8,27,5.5,Outside
2.41789E+15,Naja Treerat,8/27/2020 10:19,User,???????????????,8/27/2020,2020,8,27,6.5,
2.41789E+15,Naja Treerat,8/27/2020 10:19,Admin,?????????????????????????????????????,8/27/2020,2020,8,27,6.5,Outside
2.42085E+15,Kiettisak Bourtum,8/6/2020 8:32,Admin,????????????????????????,8/6/2020,2020,8,6,3.5,
2.42085E+15,Kiettisak Bourtum,8/6/2020 8:32,Admin,"??????????????????????????????????????????
??????????????????? 10 ????????? ???? ""0880880880""",8/6/2020,2020,8,6,3.5,Outside
2.42088E+15,Prisan Pimprasan,8/18/2020 23:41,Admin,????????????????????????????????????,8/18/2020,2020,8,18,5.5,
2.42088E+15,Prisan Pimprasan,8/18/2020 23:41,Admin,???????????????????????????????????????,8/18/2020,2020,8,18,5.5,Outside
2.42088E+15,Prisan Pimprasan,8/18/2020 23:41,Admin,?????? ?????????????,8/18/2020,2020,8,18,6.5,
2.42088E+15,Prisan Pimprasan,8/18/2020 23:41,Admin,?????????????????????????????????????,8/18/2020,2020,8,18,6.5,Outside
2.4278E+15,??????? ???????,8/17/2020 12:00,User,????????????????????????????????,8/17/2020,2020,8,17,3.5,
2.4278E+15,??????? ???????,8/17/2020 12:00,Admin,"??????????????????????????????????????????
??????????????????? 10 ????????? ???? ""0880880880""",8/17/2020,2020,8,17,3.5,Outside
2.44156E+15,????? ????,8/10/2020 7:53,User,????????????????,8/10/2020,2020,8,10,11.5,
2.44156E+15,????? ????,8/10/2020 7:53,Admin,"??????????????????? ???????????????????? ???????????????????????? ??
(???????????? ????????)",8/10/2020,2020,8,10,11.5,Outside
2.4496E+15,?????? ?????????,9/2/2020 10:59,User,???????????,9/2/2020,2020,9,2,3.5,
2.4496E+15,?????? ?????????,9/2/2020 10:59,Admin,"??????????????????????????????????????????
??????????????????? 10 ?????????? ???? ""0880880880""",9/2/2020,2020,9,2,3.5,Outside
2.4496E+15,?????? ?????????,9/2/2020 10:59,User,????????????????????????????,9/2/2020,2020,9,2,3.5,
2.4496E+15,?????? ?????????,9/2/2020 10:59,Admin,"?????????????? ?????????????????????????????????????????? ??
?????????????????????????",9/2/2020,2020,9,2,3.5,Outside
2.45247E+15,NT Nokyoong,9/4/2020 21:52,Admin,"?????? ????????????
????????????????????? ???????????????????????",9/4/2020,2020,9,4,3.5,
2.45247E+15,NT Nokyoong,9/4/2020 21:52,Admin,"??????????????????????????????????????????
??????????????????? 10 ?????????? ???? ""0880880880""",9/4/2020,2020,9,4,3.5,Outside
2.45585E+15,?????? ????,9/5/2020 16:28,User,????????,9/5/2020,2020,9,5,6.5,
2.45585E+15,?????? ????,9/5/2020 16:28,Admin,??????????????????????????????????,9/5/2020,2020,9,5,6.5,Outside
2.45774E+15,Kannapat Onnor,8/18/2020 18:04,User,?????????,8/18/2020,2020,8,18,3.5,
2.45774E+15,Kannapat Onnor,8/18/2020 18:04,Admin,"??????????????????????????????????????????
??????????????????? 10 ????????? ???? ""0880880880""",8/18/2020,2020,8,18,3.5,Outside
2.45868E+15,???????? ?????.,8/15/2020 9:31,User,????????????20,8/15/2020,2020,8,15,3.5,
2.45868E+15,???????? ?????.,8/15/2020 9:31,Admin,"??????????????????????????????????????????
??????????????????? 10 ????????? ???? ""0880880880""",8/15/2020,2020,8,15,3.5,Outside
2.45909E+15,Toeyzy Nt,8/31/2020 10:56,Admin,?? ??,8/31/2020,2020,8,31,1.5,
2.45909E+15,Toeyzy Nt,8/31/2020 10:56,Admin,??????????????????? ?????????????????????????????,8/31/2020,2020,8,31,1.5,Outside
2.46043E+15,??????? ???????????,8/30/2020 23:15,Admin,?? ??,8/30/2020,2020,8,30,1.5,
2.46043E+15,??????? ???????????,8/30/2020 23:15,Admin,??????????????????? ?????????????????????????????,8/30/2020,2020,8,30,1.5,Outside
2.46043E+15,??????? ???????????,8/30/2020 23:15,Admin,??????????????????? ?????????????????????????????,8/30/2020,2020,8,30,1.5,Outside
2.46043E+15,??????? ???????????,8/30/2020 23:15,Admin,??????????????????? ?????????????????????????????,8/30/2020,2020,8,30,1.5,Outside
2.46043E+15,??????? ???????????,8/30/2020 23:18,User,???????????????????????,8/30/2020,2020,8,30,3.5,
2.46043E+15,??????? ???????????,8/30/2020 23:18,Admin,"??????????????????????????????????????????
??????????????????? 10 ?????????? ???? ""0880880880""",8/30/2020,2020,8,30,3.5,Outside
2.46043E+15,??????? ???????????,8/30/2020 23:19,User,????????????????????????????,8/30/2020,2020,8,30,3.5,
2.46043E+15,??????? ???????????,8/30/2020 23:19,Admin,"?????????????? ?????????????????????????????????????????? ??
?????????????????????????",8/30/2020,2020,8,30,3.5,Outside
2.46264E+15,???????' ????????????,8/27/2020 20:38,Admin,?????? ?????????????,8/27/2020,2020,8,27,6.5,
2.46264E+15,???????' ????????????,8/27/2020 20:38,Admin,?????????????????????????????????????,8/27/2020,2020,8,27,6.5,Outside
2.46533E+15,???? ?????????,8/24/2020 22:21,User,???????,8/24/2020,2020,8,24,3.5,
2.46533E+15,???? ?????????,8/24/2020 22:21,Admin,"??????????????????????????????????????????
??????????????????? 10 ????????? ???? ""0880880880""",8/24/2020,2020,8,24,3.5,Outside
2.46533E+15,???? ?????????,8/24/2020 22:21,User,???????????????,8/24/2020,2020,8,24,3.5,
2.46533E+15,???? ?????????,8/24/2020 22:21,Admin,"?????????????? ?????????????????????????????????????????? ??
????????????????????????",8/24/2020,2020,8,24,3.5,Outside
2.4657E+15,?????? ??????,8/17/2020 13:26,Admin,????????????????????????,8/17/2020,2020,8,17,3.5,
2.4657E+15,?????? ??????,8/17/2020 13:26,Admin,"??????????????????????????????????????????
??????????????????? 10 ????????? ???? ""0880880880""",8/17/2020,2020,8,17,3.5,Outside
2.46835E+15,????? ??????,9/3/2020 13:25,User,???????????2????????????????????????????????,9/3/2020,2020,9,3,7.5,
2.46835E+15,????? ??????,9/3/2020 13:25,Admin,??????????????????????????????????????? ???? 2018,9/3/2020,2020,9,3,7.5,Outside
2.4694E+15,???' ???,9/2/2020 19:29,Admin,?? ??,9/2/2020,2020,9,2,1.5,
2.4694E+15,???' ???,9/2/2020 19:29,Admin,??????????????????? ?????????????????????????????,9/2/2020,2020,9,2,1.5,Outside
2.4694E+15,???' ???,9/2/2020 19:29,Admin,??????????????????? ?????????????????????????????,9/2/2020,2020,9,2,1.5,Outside
2.4694E+15,???' ???,9/2/2020 19:29,Admin,??????????????????? ?????????????????????????????,9/2/2020,2020,9,2,1.5,Outside
2.47153E+15,Sukree Chelong,8/29/2020 20:28,User,??????????????? ?????????????????????,8/29/2020,2020,8,29,1.5,
2.47153E+15,Sukree Chelong,8/29/2020 20:28,Admin,??????????????????? ?????????????????????????????,8/29/2020,2020,8,29,1.5,Outside
2.47153E+15,Sukree Chelong,8/29/2020 20:29,User,????,8/29/2020,2020,8,29,4.5,
2.47153E+15,Sukree Chelong,8/29/2020 20:29,Admin,"????????????????????????
??????? ????? ???????
?????????????? 0630682618",8/29/2020,2020,8,29,4.5,Outside
2.4742E+15,????? ???????????,9/5/2020 17:10,Admin,?? ??,9/5/2020,2020,9,5,1.5,
2.4742E+15,????? ???????????,9/5/2020 17:10,Admin,??????????????????? ?????????????????????????????,9/5/2020,2020,9,5,1.5,Outside
2.4742E+15,????? ???????????,9/5/2020 17:11,Admin,"?? ""??????"" ?????",9/5/2020,2020,9,5,3.5,
2.4742E+15,????? ???????????,9/5/2020 17:11,Admin,"??????????????????????????????????????????
??????????????????? 10 ?????????? ???? ""0880880880""",9/5/2020,2020,9,5,3.5,Outside
2.47712E+15,Nong Nan,9/3/2020 8:26,User,????????????????????? ??????????????,9/3/2020,2020,9,3,1.5,
2.47712E+15,Nong Nan,9/3/2020 8:26,Admin,??????????????????? ?????????????????????????????,9/3/2020,2020,9,3,1.5,Outside
2.4821E+15,Nantaporn Khansakorn,8/17/2020 14:00,Admin,?????? ?????????????,8/17/2020,2020,8,17,6.5,
2.4821E+15,Nantaporn Khansakorn,8/17/2020 14:00,Admin,?????????????????????????????????????,8/17/2020,2020,8,17,6.5,Outside
2.48306E+15,Matchima Umpan,9/5/2020 21:01,Admin,CRS_Carinsurance2,9/5/2020,2020,9,5,1.5,
2.48306E+15,Matchima Umpan,9/5/2020 21:01,Admin,??????????????????? ?????????????????????????????,9/5/2020,2020,9,5,1.5,Outside
2.48347E+15,?????? ???????,8/6/2020 19:51,User,GPX,8/6/2020,2020,8,6,5.5,
2.48347E+15,?????? ???????,8/6/2020 19:51,Admin,???????????????????????????????????????,8/6/2020,2020,8,6,5.5,Outside
2.48347E+15,?????? ???????,8/6/2020 19:53,Admin,?????? ?????????????,8/6/2020,2020,8,6,6.5,
2.48347E+15,?????? ???????,8/6/2020 19:53,Admin,?????????????????????????????????????,8/6/2020,2020,8,6,6.5,Outside
2.48347E+15,?????? ???????,9/5/2020 12:37,User,???? ????????,9/5/2020,2020,9,5,3.5,
2.48347E+15,?????? ???????,9/5/2020 12:37,Admin,"??????????????????????????????????????????
??????????????????? 10 ?????????? ???? ""0880880880""",9/5/2020,2020,9,5,3.5,Outside
2.48347E+15,?????? ???????,9/5/2020 12:38,User,G P X,9/5/2020,2020,9,5,5.5,
2.48347E+15,?????? ???????,9/5/2020 12:38,Admin,????????????????????????????????????,9/5/2020,2020,9,5,5.5,Outside
2.48378E+15,Bew Wareerat,8/9/2020 18:51,User,??????,8/9/2020,2020,8,9,11.5,
2.48378E+15,Bew Wareerat,8/9/2020 18:51,Admin,"??????????????????? ???????????????????? ???????????????????????? ??
(???????????? ????????)",8/9/2020,2020,8,9,11.5,Outside
2.49275E+15,None None,9/5/2020 6:38,User,369239263222822,9/5/2020,2020,9,5,1.5,
2.49275E+15,None None,9/5/2020 6:38,Admin,??????????????????? ?????????????????????????????,9/5/2020,2020,9,5,1.5,Outside
2.49608E+15,Jirayu Maisod,8/30/2020 23:08,Admin,?? ??,8/30/2020,2020,8,30,3.5,
2.49608E+15,Jirayu Maisod,8/30/2020 23:08,Admin,"??????????????????????????????????????????
??????????????????? 10 ?????????? ???? ""0880880880""",8/30/2020,2020,8,30,3.5,Outside
2.49608E+15,Jirayu Maisod,8/30/2020 23:08,Admin,"??????????????????????????????????????????
??????????????????? 10 ?????????? ???? ""0880880880""",8/30/2020,2020,8,30,3.5,Outside
2.49608E+15,Jirayu Maisod,8/30/2020 23:08,Admin,??????????????????? ?????????????????????????????,8/30/2020,2020,8,30,1.5,Outside
2.49913E+15,??????? ?????,8/30/2020 14:58,Admin,CRS_Carinsurance2,8/30/2020,2020,8,30,1.5,
2.49913E+15,??????? ?????,8/30/2020 14:58,Admin,??????????????????? ?????????????????????????????,8/30/2020,2020,8,30,1.5,Outside
2.49977E+15,??????? ?????????,9/2/2020 15:37,Admin,????????????????????????????????,9/2/2020,2020,9,2,1.5,
2.49977E+15,??????? ?????????,9/2/2020 15:37,Admin,??????????????????? ?????????????????????????????,9/2/2020,2020,9,2,1.5,Outside
2.50029E+15,Koor Bupasiri,8/27/2020 17:10,User,??????,8/27/2020,2020,8,27,11.5,
2.50029E+15,Koor Bupasiri,8/27/2020 17:10,Admin,"??????????????????? ???????????????????? ???????????????????????? ??
(???????????? ????????)",8/27/2020,2020,8,27,11.5,Outside
2.5005E+15,????????? ????????,9/3/2020 20:30,Admin,IMG_Answer,9/3/2020,2020,9,3,1.5,
2.5005E+15,????????? ????????,9/3/2020 20:30,Admin,??????????????????? ?????????????????????????????,9/3/2020,2020,9,3,1.5,Outside
2.50198E+15,????'??? ?????????,8/18/2020 13:40,Admin,?????? ?????????????,8/18/2020,2020,8,18,6.5,
2.50198E+15,????'??? ?????????,8/18/2020 13:40,Admin,?????????????????????????????????????,8/18/2020,2020,8,18,6.5,Outside
2.5026E+15,Noonam Chananchida,8/6/2020 17:28,Admin,?????? ?????????????,8/6/2020,2020,8,6,6.5,
2.5026E+15,Noonam Chananchida,8/6/2020 17:28,Admin,?????????????????????????????????????,8/6/2020,2020,8,6,6.5,Outside
2.5026E+15,Noonam Chananchida,8/6/2020 17:29,Admin,?????? ?????????????,8/6/2020,2020,8,6,6.5,
2.5026E+15,Noonam Chananchida,8/6/2020 17:29,Admin,?????????????????????????????????????,8/6/2020,2020,8,6,6.5,Outside
2.5026E+15,Noonam Chananchida,8/6/2020 17:29,Admin,CRS_Motorcycleloan2,8/6/2020,2020,8,6,6.5,
2.5026E+15,Noonam Chananchida,8/6/2020 17:29,Admin,?????????????????????????????????????,8/6/2020,2020,8,6,6.5,Outside
2.50748E+15,Manow Potae,8/25/2020 7:49,User,0970825151 ??????????????????,8/25/2020,2020,8,25,3.5,
2.50748E+15,Manow Potae,8/25/2020 7:49,Admin,"??????????????????????????????????????????
??????????????????? 10 ????????? ???? ""0880880880""",8/25/2020,2020,8,25,3.5,Outside
2.50832E+15,Bumint Love Ton,9/6/2020 20:45,User,??????,9/6/2020,2020,9,6,3.5,
2.50832E+15,Bumint Love Ton,9/6/2020 20:45,Admin,"??????????????????????????????????????????
??????????????????? 10 ?????????? ???? ""0880880880""",9/6/2020,2020,9,6,3.5,Outside
2.50832E+15,Bumint Love Ton,9/6/2020 20:46,Admin,?? ??,9/6/2020,2020,9,6,3.5,
2.50832E+15,Bumint Love Ton,9/6/2020 20:46,Admin,"?????????????? ?????????????????????????????????????????? ??
?????????????????????????",9/6/2020,2020,9,6,3.5,Outside
2.50832E+15,Bumint Love Ton,9/6/2020 20:46,Admin,"?????????????? ?????????????????????????????????????????? ??
?????????????????????????",9/6/2020,2020,9,6,3.5,Outside
2.50832E+15,Bumint Love Ton,9/6/2020 20:46,Admin,??????????????????? ?????????????????????????????,9/6/2020,2020,9,6,1.5,Outside
2.50841E+15,??? ????????,9/2/2020 17:14,User,Toyota,9/2/2020,2020,9,2,1.5,
2.50841E+15,??? ????????,9/2/2020 17:14,Admin,??????????????????? ?????????????????????????????,9/2/2020,2020,9,2,1.5,Outside
2.51397E+15,?????? ??????,9/4/2020 15:43,Admin,CRS_Carinsurance2,9/4/2020,2020,9,4,1.5,
2.51397E+15,?????? ??????,9/4/2020 15:43,Admin,??????????????????? ?????????????????????????????,9/4/2020,2020,9,4,1.5,Outside
2.51397E+15,?????? ??????,9/4/2020 15:44,User,??????  ??????,9/4/2020,2020,9,4,3.5,
2.51397E+15,?????? ??????,9/4/2020 15:44,Admin,"??????????????????????????????????????????
??????????????????? 10 ?????????? ???? ""0880880880""",9/4/2020,2020,9,4,3.5,Outside
2.52103E+15,Apk Carp,9/6/2020 11:46,Admin,?? ??,9/6/2020,2020,9,6,2.5,
2.52103E+15,Apk Carp,9/6/2020 11:46,Admin,??????? - ??????? ????????,9/6/2020,2020,9,6,2.5,Outside
2.52103E+15,Apk Carp,9/6/2020 11:46,Admin,??????? - ??????? ????????,9/6/2020,2020,9,6,2.5,Outside
2.52103E+15,Apk Carp,9/6/2020 11:46,Admin,??????????????????? ?????????????????????????????,9/6/2020,2020,9,6,1.5,Outside
2.52839E+15,????? ?????.,8/30/2020 22:40,User,???? ???????? (???????),8/30/2020,2020,8,30,2.5,
2.52839E+15,????? ?????.,8/30/2020 22:40,Admin,??????? - ??????? ????????,8/30/2020,2020,8,30,2.5,Outside
2.53051E+15,?????? ??????????,8/17/2020 18:27,User,093-1108308,8/17/2020,2020,8,17,3.5,
2.53051E+15,?????? ??????????,8/17/2020 18:27,Admin,"??????????????????????????????????????????
??????????????????? 10 ????????? ???? ""0880880880""",8/17/2020,2020,8,17,3.5,Outside
2.53057E+15,Pornnapa Muay,8/18/2020 13:55,Admin,"????????????????????
- ?????????????? 7 ??
- ????????????????????? 5 ?? 
???????????????????????????????????????????(???.) ?????????????????????????????????????????????????",8/18/2020,2020,8,18,3.5,
2.53057E+15,Pornnapa Muay,8/18/2020 13:55,Admin,"??????????????????????????????????????????
??????????????????? 10 ????????? ???? ""0880880880""",8/18/2020,2020,8,18,3.5,Outside
2.53057E+15,Pornnapa Muay,8/18/2020 13:56,User,???????,8/18/2020,2020,8,18,5.5,
2.53057E+15,Pornnapa Muay,8/18/2020 13:56,Admin,???????????????????????????????????????,8/18/2020,2020,8,18,5.5,Outside
2.53318E+15,????????? ?????????,8/21/2020 7:18,Admin,?????? ?????????????,8/21/2020,2020,8,21,6.5,
2.53318E+15,????????? ?????????,8/21/2020 7:18,Admin,?????????????????????????????????????,8/21/2020,2020,8,21,6.5,Outside
2.53318E+15,????????? ?????????,8/21/2020 7:18,User,???x,8/21/2020,2020,8,21,6.5,
2.53318E+15,????????? ?????????,8/21/2020 7:18,Admin,?????????????????????????????????????,8/21/2020,2020,8,21,6.5,Outside
2.53786E+15,?? ????? ???????,8/16/2020 7:08,User,6030457275,8/16/2020,2020,8,16,3.5,
2.53786E+15,?? ????? ???????,8/16/2020 7:08,Admin,"??????????????????????????????????????????
??????????????????? 10 ????????? ???? ""0880880880""",8/16/2020,2020,8,16,3.5,Outside
2.54162E+15,Oat Chotchatchawan,9/2/2020 9:20,User,?????????????,9/2/2020,2020,9,2,3.5,
2.54162E+15,Oat Chotchatchawan,9/2/2020 9:20,Admin,"??????????????????????????????????????????
??????????????????? 10 ?????????? ???? ""0880880880""",9/2/2020,2020,9,2,3.5,Outside
2.54162E+15,Oat Chotchatchawan,9/2/2020 9:20,User,??,9/2/2020,2020,9,2,3.5,
2.54162E+15,Oat Chotchatchawan,9/2/2020 9:20,Admin,"?????????????? ?????????????????????????????????????????? ??
?????????????????????????",9/2/2020,2020,9,2,3.5,Outside
2.54229E+15,???????? ???????,9/2/2020 9:06,User,????????,9/2/2020,2020,9,2,3.5,
2.54229E+15,???????? ???????,9/2/2020 9:06,Admin,"??????????????????????????????????????????
??????????????????? 10 ????????? ???? ""0880880880""",9/2/2020,2020,9,2,3.5,Outside
2.54229E+15,???????? ???????,9/2/2020 9:06,Admin,"?? ""??????"" ????????????????????????? ???????????????? ?????????????????????????",9/2/2020,2020,9,2,3.5,
2.54229E+15,???????? ???????,9/2/2020 9:06,Admin,"?????????????? ?????????????????????????????????????????? ??
????????????????????????",9/2/2020,2020,9,2,3.5,Outside
2.54272E+15,Bantita Sringam,9/4/2020 11:53,User,?????????1,9/4/2020,2020,9,4,2.5,
2.54272E+15,Bantita Sringam,9/4/2020 11:53,Admin,??????? - ??????? ????????,9/4/2020,2020,9,4,2.5,Outside
2.54272E+15,Bantita Sringam,9/4/2020 12:13,User,??????,9/4/2020,2020,9,4,4.5,
2.54272E+15,Bantita Sringam,9/4/2020 12:13,Admin,"????????????????????????
??????? ?????
?????????????? 0896025593",9/4/2020,2020,9,4,4.5,Outside
2.54272E+15,Bantita Sringam,9/4/2020 12:14,User,2058,9/4/2020,2020,9,4,7.5,
2.54272E+15,Bantita Sringam,9/4/2020 12:14,Admin,??????????????????????????????????????? ???? 2018,9/4/2020,2020,9,4,7.5,Outside
2.5455E+15,??? ??? ??? ???,8/30/2020 17:33,Admin,CRS_Carinsurance2,8/30/2020,2020,8,30,1.5,
2.5455E+15,??? ??? ??? ???,8/30/2020 17:33,Admin,??????????????????? ?????????????????????????????,8/30/2020,2020,8,30,1.5,Outside
2.54625E+15,???????????? ?????????????,9/7/2020 12:49,Admin,IMG_Answer,9/7/2020,2020,9,7,5.5,
2.54625E+15,???????????? ?????????????,9/7/2020 12:49,Admin,????????????????????????????????????,9/7/2020,2020,9,7,5.5,Outside
2.54625E+15,???????????? ?????????????,9/7/2020 12:52,User,??????????,9/7/2020,2020,9,7,11.5,
2.54625E+15,???????????? ?????????????,9/7/2020 12:52,Admin,"???????????????? ???????????????????? ???????????????????????? ??
(???????????? ?????)",9/7/2020,2020,9,7,11.5,Outside
2.54717E+15,?????? ?????????,9/3/2020 9:04,Admin,?? ??,9/3/2020,2020,9,3,1.5,
2.54717E+15,?????? ?????????,9/3/2020 9:04,Admin,??????????????????? ?????????????????????????????,9/3/2020,2020,9,3,1.5,Outside
2.5472E+15,???? ??????,8/7/2020 10:32,User,?????????????????,8/7/2020,2020,8,7,3.5,
2.5472E+15,???? ??????,8/7/2020 10:32,Admin,"??????????????????????????????????????????
??????????????????? 10 ????????? ???? ""0880880880""",8/7/2020,2020,8,7,3.5,Outside
2.5472E+15,???? ??????,8/7/2020 10:33,User,????6????????,8/7/2020,2020,8,7,3.5,
2.5472E+15,???? ??????,8/7/2020 10:33,Admin,"?????????????? ?????????????????????????????????????????? ??
????????????????????????",8/7/2020,2020,8,7,3.5,Outside
2.55475E+15,Hattaya Kaewwongsod,8/27/2020 7:25,User,??????????????????,8/27/2020,2020,8,27,3.5,
2.55475E+15,Hattaya Kaewwongsod,8/27/2020 7:25,Admin,"??????????????????????????????????????????
??????????????????? 10 ????????? ???? ""0880880880""",8/27/2020,2020,8,27,3.5,Outside
2.55562E+15,Chanta Kaewduangdee,9/2/2020 3:38,Admin,CRS_Carinsurance2,9/2/2020,2020,9,2,1.5,
2.55562E+15,Chanta Kaewduangdee,9/2/2020 3:38,Admin,??????????????????? ?????????????????????????????,9/2/2020,2020,9,2,1.5,Outside
2.55616E+15,????? ????????,8/31/2020 18:42,Admin,IMG_Privatepolicy,8/31/2020,2020,8,31,9.5,
2.55616E+15,????? ????????,8/31/2020 18:42,Admin,??????????????????????????????,8/31/2020,2020,8,31,9.5,Outside
